"No.","Time","Source","Destination","Protocol","Length","Info"
"11127","66.290451","fe80::200:ff:fe00:51","fe80::200:ff:fe00:2","TCP","112","49153  >  8080 [SYN] Seq=0 Win=32768 Len=0 WS=4 TSval=65000 TSecr=0"
"11133","66.295224","fe80::200:ff:fe00:51","fe80::200:ff:fe00:2","TCP","108","49153  >  8080 [ACK] Seq=1 Ack=1 Win=131072 Len=0 TSval=66293 TSecr=66290"
"11139","66.309228","fe80::200:ff:fe00:51","fe80::200:ff:fe00:2","TCP","644","49153  >  8080 [ACK] Seq=1 Ack=1 Win=131072 Len=536 TSval=66293 TSecr=66290"
"11143","66.316417","fe80::200:ff:fe00:51","fe80::200:ff:fe00:2","TCP","644","49153  >  8080 [ACK] Seq=537 Ack=1 Win=131072 Len=536 TSval=66310 TSecr=66309"
"11145","66.322206","fe80::200:ff:fe00:51","fe80::200:ff:fe00:2","TCP","644","49153  >  8080 [ACK] Seq=1073 Ack=1 Win=131072 Len=536 TSval=66310 TSecr=66309"
"11149","66.329615","fe80::200:ff:fe00:51","fe80::200:ff:fe00:2","TCP","644","49153  >  8080 [ACK] Seq=1609 Ack=1 Win=131072 Len=536 TSval=66324 TSecr=66322"
"11151","66.335843","fe80::200:ff:fe00:51","fe80::200:ff:fe00:2","TCP","644","49153  >  8080 [ACK] Seq=2145 Ack=1 Win=131072 Len=536 TSval=66324 TSecr=66322"
"11155","66.343152","fe80::200:ff:fe00:51","fe80::200:ff:fe00:2","TCP","644","49153  >  8080 [ACK] Seq=2681 Ack=1 Win=131072 Len=536 TSval=66324 TSecr=66322"
"11157","66.348941","fe80::200:ff:fe00:51","fe80::200:ff:fe00:2","TCP","644","49153  >  8080 [ACK] Seq=3217 Ack=1 Win=131072 Len=536 TSval=66337 TSecr=66336"
"11161","66.356570","fe80::200:ff:fe00:51","fe80::200:ff:fe00:2","TCP","644","49153  >  8080 [ACK] Seq=3753 Ack=1 Win=131072 Len=536 TSval=66337 TSecr=66336"
"11166","66.365678","fe80::200:ff:fe00:51","fe80::200:ff:fe00:2","TCP","644","49153  >  8080 [ACK] Seq=4289 Ack=1 Win=131072 Len=536 TSval=66337 TSecr=66336"
"11171","66.374585","fe80::200:ff:fe00:51","fe80::200:ff:fe00:2","TCP","644","49153  >  8080 [ACK] Seq=4825 Ack=1 Win=131072 Len=536 TSval=66350 TSecr=66349"
"11175","66.387223","fe80::200:ff:fe00:51","fe80::200:ff:fe00:2","TCP","644","49153  >  8080 [ACK] Seq=5361 Ack=1 Win=131072 Len=536 TSval=66350 TSecr=66349"
"11179","66.394952","fe80::200:ff:fe00:51","fe80::200:ff:fe00:2","TCP","644","49153  >  8080 [ACK] Seq=5897 Ack=1 Win=131072 Len=536 TSval=66350 TSecr=66349"
"11181","66.401141","fe80::200:ff:fe00:51","fe80::200:ff:fe00:2","TCP","644","49153  >  8080 [ACK] Seq=6433 Ack=1 Win=131072 Len=536 TSval=66367 TSecr=66365"
"11185","66.408470","fe80::200:ff:fe00:51","fe80::200:ff:fe00:2","TCP","644","49153  >  8080 [ACK] Seq=6969 Ack=1 Win=131072 Len=536 TSval=66367 TSecr=66365"
"11187","66.414519","fe80::200:ff:fe00:51","fe80::200:ff:fe00:2","TCP","644","49153  >  8080 [ACK] Seq=7505 Ack=1 Win=131072 Len=536 TSval=66367 TSecr=66365"
"11191","66.422248","fe80::200:ff:fe00:51","fe80::200:ff:fe00:2","TCP","644","49153  >  8080 [ACK] Seq=8041 Ack=1 Win=131072 Len=536 TSval=66388 TSecr=66387"
"11193","66.428257","fe80::200:ff:fe00:51","fe80::200:ff:fe00:2","TCP","644","49153  >  8080 [ACK] Seq=8577 Ack=1 Win=131072 Len=536 TSval=66388 TSecr=66387"
"11197","66.435554","fe80::200:ff:fe00:51","fe80::200:ff:fe00:2","TCP","644","49153  >  8080 [ACK] Seq=9113 Ack=1 Win=131072 Len=536 TSval=66388 TSecr=66387"
"11199","66.441783","fe80::200:ff:fe00:51","fe80::200:ff:fe00:2","TCP","644","49153  >  8080 [ACK] Seq=9649 Ack=1 Win=131072 Len=536 TSval=66402 TSecr=66401"
"11204","66.449994","fe80::200:ff:fe00:51","fe80::200:ff:fe00:2","TCP","644","49153  >  8080 [ACK] Seq=10185 Ack=1 Win=131072 Len=536 TSval=66402 TSecr=66401"
"11206","66.460341","fe80::200:ff:fe00:51","fe80::200:ff:fe00:2","TCP","644","49153  >  8080 [ACK] Seq=10721 Ack=1 Win=131072 Len=536 TSval=66402 TSecr=66401"
"11210","66.467257","fe80::200:ff:fe00:51","fe80::200:ff:fe00:2","TCP","644","49153  >  8080 [ACK] Seq=11257 Ack=1 Win=131072 Len=536 TSval=66416 TSecr=66414"
"11212","66.473306","fe80::200:ff:fe00:51","fe80::200:ff:fe00:2","TCP","644","49153  >  8080 [ACK] Seq=11793 Ack=1 Win=131072 Len=536 TSval=66416 TSecr=66414"
"11215","66.480263","fe80::200:ff:fe00:51","fe80::200:ff:fe00:2","TCP","644","49153  >  8080 [ACK] Seq=12329 Ack=1 Win=131072 Len=536 TSval=66416 TSecr=66414"
"11217","66.486032","fe80::200:ff:fe00:51","fe80::200:ff:fe00:2","TCP","644","49153  >  8080 [ACK] Seq=12865 Ack=1 Win=131072 Len=536 TSval=66429 TSecr=66428"
"11219","66.491741","fe80::200:ff:fe00:51","fe80::200:ff:fe00:2","TCP","644","49153  >  8080 [ACK] Seq=13401 Ack=1 Win=131072 Len=536 TSval=66429 TSecr=66428"
"11221","66.497570","fe80::200:ff:fe00:51","fe80::200:ff:fe00:2","TCP","644","49153  >  8080 [ACK] Seq=13937 Ack=1 Win=131072 Len=536 TSval=66429 TSecr=66428"
"11224","66.504527","fe80::200:ff:fe00:51","fe80::200:ff:fe00:2","TCP","644","49153  >  8080 [ACK] Seq=14473 Ack=1 Win=131072 Len=536 TSval=66443 TSecr=66441"
"11226","66.510576","fe80::200:ff:fe00:51","fe80::200:ff:fe00:2","TCP","644","49153  >  8080 [ACK] Seq=15009 Ack=1 Win=131072 Len=536 TSval=66443 TSecr=66441"
"11228","66.516445","fe80::200:ff:fe00:51","fe80::200:ff:fe00:2","TCP","644","49153  >  8080 [ACK] Seq=15545 Ack=1 Win=131072 Len=536 TSval=66443 TSecr=66441"
"11230","66.519818","fe80::200:ff:fe00:51","fe80::200:ff:fe00:2","TCP","644","49153  >  8080 [ACK] Seq=16081 Ack=1 Win=131072 Len=536 TSval=66461 TSecr=66460"
"11232","66.522951","fe80::200:ff:fe00:51","fe80::200:ff:fe00:2","TCP","644","49153  >  8080 [ACK] Seq=16617 Ack=1 Win=131072 Len=536 TSval=66461 TSecr=66460"
"11236","66.527624","fe80::200:ff:fe00:51","fe80::200:ff:fe00:2","TCP","644","49153  >  8080 [ACK] Seq=17153 Ack=1 Win=131072 Len=536 TSval=66461 TSecr=66460"
"11248","66.550627","fe80::200:ff:fe00:51","fe80::200:ff:fe00:2","TCP","644","49153  >  8080 [ACK] Seq=17689 Ack=1 Win=131072 Len=536 TSval=66524 TSecr=66473"
"11250","66.556716","fe80::200:ff:fe00:51","fe80::200:ff:fe00:2","TCP","644","49153  >  8080 [ACK] Seq=18225 Ack=1 Win=131072 Len=536 TSval=66524 TSecr=66473"
"11254","66.564425","fe80::200:ff:fe00:51","fe80::200:ff:fe00:2","TCP","644","49153  >  8080 [ACK] Seq=18761 Ack=1 Win=131072 Len=536 TSval=66524 TSecr=66473"
"11256","66.570574","fe80::200:ff:fe00:51","fe80::200:ff:fe00:2","TCP","644","49153  >  8080 [ACK] Seq=19297 Ack=1 Win=131072 Len=536 TSval=66529 TSecr=66486"
"11260","66.578263","fe80::200:ff:fe00:51","fe80::200:ff:fe00:2","TCP","644","49153  >  8080 [ACK] Seq=19833 Ack=1 Win=131072 Len=536 TSval=66529 TSecr=66486"
"11262","66.584552","fe80::200:ff:fe00:51","fe80::200:ff:fe00:2","TCP","644","49153  >  8080 [ACK] Seq=20369 Ack=1 Win=131072 Len=536 TSval=66529 TSecr=66486"
"11266","66.591700","fe80::200:ff:fe00:51","fe80::200:ff:fe00:2","TCP","644","49153  >  8080 [ACK] Seq=20905 Ack=1 Win=131072 Len=536 TSval=66531 TSecr=66497"
"11268","66.598009","fe80::200:ff:fe00:51","fe80::200:ff:fe00:2","TCP","644","49153  >  8080 [ACK] Seq=21441 Ack=1 Win=131072 Len=536 TSval=66531 TSecr=66497"
"11272","66.605258","fe80::200:ff:fe00:51","fe80::200:ff:fe00:2","TCP","644","49153  >  8080 [ACK] Seq=21977 Ack=1 Win=131072 Len=536 TSval=66531 TSecr=66497"
"11274","66.611427","fe80::200:ff:fe00:51","fe80::200:ff:fe00:2","TCP","644","49153  >  8080 [ACK] Seq=22513 Ack=1 Win=131072 Len=536 TSval=66535 TSecr=66510"
"11278","66.621942","fe80::200:ff:fe00:51","fe80::200:ff:fe00:2","TCP","644","49153  >  8080 [ACK] Seq=23049 Ack=1 Win=131072 Len=536 TSval=66535 TSecr=66510"
"11280","66.628011","fe80::200:ff:fe00:51","fe80::200:ff:fe00:2","TCP","644","49153  >  8080 [ACK] Seq=23585 Ack=1 Win=131072 Len=536 TSval=66535 TSecr=66510"
"11284","66.635268","fe80::200:ff:fe00:51","fe80::200:ff:fe00:2","TCP","644","49153  >  8080 [ACK] Seq=24121 Ack=1 Win=131072 Len=536 TSval=66537 TSecr=66519"
"11286","66.641237","fe80::200:ff:fe00:51","fe80::200:ff:fe00:2","TCP","644","49153  >  8080 [ACK] Seq=24657 Ack=1 Win=131072 Len=536 TSval=66537 TSecr=66519"
"11290","66.647994","fe80::200:ff:fe00:51","fe80::200:ff:fe00:2","TCP","644","49153  >  8080 [ACK] Seq=25193 Ack=1 Win=131072 Len=536 TSval=66537 TSecr=66519"
"11292","66.654083","fe80::200:ff:fe00:51","fe80::200:ff:fe00:2","TCP","644","49153  >  8080 [ACK] Seq=25729 Ack=1 Win=131072 Len=536 TSval=66539 TSecr=66527"
"11297","66.661994","fe80::200:ff:fe00:51","fe80::200:ff:fe00:2","TCP","644","49153  >  8080 [ACK] Seq=26265 Ack=1 Win=131072 Len=536 TSval=66539 TSecr=66527"
"11299","66.667763","fe80::200:ff:fe00:51","fe80::200:ff:fe00:2","TCP","644","49153  >  8080 [ACK] Seq=26801 Ack=1 Win=131072 Len=536 TSval=66539 TSecr=66527"
"11303","66.675080","fe80::200:ff:fe00:51","fe80::200:ff:fe00:2","TCP","644","49153  >  8080 [ACK] Seq=27337 Ack=1 Win=131072 Len=536 TSval=66558 TSecr=66556"
"11305","66.681249","fe80::200:ff:fe00:51","fe80::200:ff:fe00:2","TCP","644","49153  >  8080 [ACK] Seq=27873 Ack=1 Win=131072 Len=536 TSval=66558 TSecr=66556"
"11309","66.685690","fe80::200:ff:fe00:51","fe80::200:ff:fe00:2","TCP","644","49153  >  8080 [ACK] Seq=28409 Ack=1 Win=131072 Len=536 TSval=66558 TSecr=66556"
"11311","66.689223","fe80::200:ff:fe00:51","fe80::200:ff:fe00:2","TCP","644","49153  >  8080 [ACK] Seq=28945 Ack=1 Win=131072 Len=536 TSval=66572 TSecr=66570"
"11315","66.693964","fe80::200:ff:fe00:51","fe80::200:ff:fe00:2","TCP","644","49153  >  8080 [ACK] Seq=29481 Ack=1 Win=131072 Len=536 TSval=66572 TSecr=66570"
"11317","66.706069","fe80::200:ff:fe00:51","fe80::200:ff:fe00:2","TCP","644","49153  >  8080 [ACK] Seq=30017 Ack=1 Win=131072 Len=536 TSval=66572 TSecr=66570"
"11321","66.713026","fe80::200:ff:fe00:51","fe80::200:ff:fe00:2","TCP","644","49153  >  8080 [ACK] Seq=30553 Ack=1 Win=131072 Len=536 TSval=66586 TSecr=66584"
"11323","66.718755","fe80::200:ff:fe00:51","fe80::200:ff:fe00:2","TCP","644","49153  >  8080 [ACK] Seq=31089 Ack=1 Win=131072 Len=536 TSval=66586 TSecr=66584"
"11327","66.726032","fe80::200:ff:fe00:51","fe80::200:ff:fe00:2","TCP","644","49153  >  8080 [ACK] Seq=31625 Ack=1 Win=131072 Len=536 TSval=66586 TSecr=66584"
"11329","66.732041","fe80::200:ff:fe00:51","fe80::200:ff:fe00:2","TCP","644","49153  >  8080 [ACK] Seq=32161 Ack=1 Win=131072 Len=536 TSval=66599 TSecr=66598"
"11333","66.739017","fe80::200:ff:fe00:51","fe80::200:ff:fe00:2","TCP","644","49153  >  8080 [ACK] Seq=32697 Ack=1 Win=131072 Len=536 TSval=66599 TSecr=66598"
"11335","66.745146","fe80::200:ff:fe00:51","fe80::200:ff:fe00:2","TCP","644","49153  >  8080 [ACK] Seq=33233 Ack=1 Win=131072 Len=536 TSval=66599 TSecr=66598"
"11339","66.752223","fe80::200:ff:fe00:51","fe80::200:ff:fe00:2","TCP","644","49153  >  8080 [ACK] Seq=33769 Ack=1 Win=131072 Len=536 TSval=66612 TSecr=66611"
"11341","66.757992","fe80::200:ff:fe00:51","fe80::200:ff:fe00:2","TCP","644","49153  >  8080 [ACK] Seq=34305 Ack=1 Win=131072 Len=536 TSval=66612 TSecr=66611"
"11345","66.765029","fe80::200:ff:fe00:51","fe80::200:ff:fe00:2","TCP","644","49153  >  8080 [ACK] Seq=34841 Ack=1 Win=131072 Len=536 TSval=66612 TSecr=66611"
"11347","66.775696","fe80::200:ff:fe00:51","fe80::200:ff:fe00:2","TCP","644","49153  >  8080 [ACK] Seq=35377 Ack=1 Win=131072 Len=536 TSval=66629 TSecr=66628"
"11351","66.782733","fe80::200:ff:fe00:51","fe80::200:ff:fe00:2","TCP","644","49153  >  8080 [ACK] Seq=35913 Ack=1 Win=131072 Len=536 TSval=66629 TSecr=66628"
"11353","66.788822","fe80::200:ff:fe00:51","fe80::200:ff:fe00:2","TCP","644","49153  >  8080 [ACK] Seq=36449 Ack=1 Win=131072 Len=536 TSval=66629 TSecr=66628"
"11356","66.795825","fe80::200:ff:fe00:51","fe80::200:ff:fe00:2","TCP","644","49153  >  8080 [ACK] Seq=36985 Ack=1 Win=131072 Len=536 TSval=66642 TSecr=66641"
"11360","66.803002","fe80::200:ff:fe00:51","fe80::200:ff:fe00:2","TCP","644","49153  >  8080 [ACK] Seq=37521 Ack=1 Win=131072 Len=536 TSval=66642 TSecr=66641"
"11364","66.809939","fe80::200:ff:fe00:51","fe80::200:ff:fe00:2","TCP","644","49153  >  8080 [ACK] Seq=38057 Ack=1 Win=131072 Len=536 TSval=66642 TSecr=66641"
"11366","66.815848","fe80::200:ff:fe00:51","fe80::200:ff:fe00:2","TCP","644","49153  >  8080 [ACK] Seq=38593 Ack=1 Win=131072 Len=536 TSval=66656 TSecr=66654"
"11370","66.822805","fe80::200:ff:fe00:51","fe80::200:ff:fe00:2","TCP","644","49153  >  8080 [ACK] Seq=39129 Ack=1 Win=131072 Len=536 TSval=66656 TSecr=66654"
"11372","66.828974","fe80::200:ff:fe00:51","fe80::200:ff:fe00:2","TCP","644","49153  >  8080 [ACK] Seq=39665 Ack=1 Win=131072 Len=536 TSval=66656 TSecr=66654"
"11376","66.835951","fe80::200:ff:fe00:51","fe80::200:ff:fe00:2","TCP","644","49153  >  8080 [ACK] Seq=40201 Ack=1 Win=131072 Len=536 TSval=66668 TSecr=66667"
"11378","66.839584","fe80::200:ff:fe00:51","fe80::200:ff:fe00:2","TCP","644","49153  >  8080 [ACK] Seq=40737 Ack=1 Win=131072 Len=536 TSval=66668 TSecr=66667"
"11382","66.844065","fe80::200:ff:fe00:51","fe80::200:ff:fe00:2","TCP","644","49153  >  8080 [ACK] Seq=41273 Ack=1 Win=131072 Len=536 TSval=66668 TSecr=66667"
"11384","66.851056","fe80::200:ff:fe00:51","fe80::200:ff:fe00:2","TCP","644","49153  >  8080 [ACK] Seq=41809 Ack=1 Win=131072 Len=536 TSval=66682 TSecr=66681"
"11389","66.856731","fe80::200:ff:fe00:51","fe80::200:ff:fe00:2","TCP","644","49153  >  8080 [ACK] Seq=42345 Ack=1 Win=131072 Len=536 TSval=66682 TSecr=66681"
"11391","66.860084","fe80::200:ff:fe00:51","fe80::200:ff:fe00:2","TCP","644","49153  >  8080 [ACK] Seq=42881 Ack=1 Win=131072 Len=536 TSval=66682 TSecr=66681"
"11395","66.864365","fe80::200:ff:fe00:51","fe80::200:ff:fe00:2","TCP","644","49153  >  8080 [ACK] Seq=43417 Ack=1 Win=131072 Len=536 TSval=66690 TSecr=66689"
"11397","66.879789","fe80::200:ff:fe00:51","fe80::200:ff:fe00:2","TCP","644","49153  >  8080 [ACK] Seq=43953 Ack=1 Win=131072 Len=536 TSval=66690 TSecr=66689"
"11401","66.887066","fe80::200:ff:fe00:51","fe80::200:ff:fe00:2","TCP","644","49153  >  8080 [ACK] Seq=44489 Ack=1 Win=131072 Len=536 TSval=66690 TSecr=66689"
"11403","66.893335","fe80::200:ff:fe00:51","fe80::200:ff:fe00:2","TCP","644","49153  >  8080 [ACK] Seq=45025 Ack=1 Win=131072 Len=536 TSval=66707 TSecr=66706"
"11408","66.906087","fe80::200:ff:fe00:51","fe80::200:ff:fe00:2","TCP","644","49153  >  8080 [ACK] Seq=45561 Ack=1 Win=131072 Len=536 TSval=66707 TSecr=66706"
"11410","66.912176","fe80::200:ff:fe00:51","fe80::200:ff:fe00:2","TCP","644","49153  >  8080 [ACK] Seq=46097 Ack=1 Win=131072 Len=536 TSval=66707 TSecr=66706"
"11413","66.919313","fe80::200:ff:fe00:51","fe80::200:ff:fe00:2","TCP","644","49153  >  8080 [ACK] Seq=46633 Ack=1 Win=131072 Len=536 TSval=66719 TSecr=66718"
"11415","66.925442","fe80::200:ff:fe00:51","fe80::200:ff:fe00:2","TCP","644","49153  >  8080 [ACK] Seq=47169 Ack=1 Win=131072 Len=536 TSval=66719 TSecr=66718"
"11417","66.931251","fe80::200:ff:fe00:51","fe80::200:ff:fe00:2","TCP","644","49153  >  8080 [ACK] Seq=47705 Ack=1 Win=131072 Len=536 TSval=66719 TSecr=66718"
"11419","66.937060","fe80::200:ff:fe00:51","fe80::200:ff:fe00:2","TCP","644","49153  >  8080 [ACK] Seq=48241 Ack=1 Win=131072 Len=536 TSval=66733 TSecr=66732"
"11423","66.944017","fe80::200:ff:fe00:51","fe80::200:ff:fe00:2","TCP","644","49153  >  8080 [ACK] Seq=48777 Ack=1 Win=131072 Len=536 TSval=66733 TSecr=66732"
"11427","66.950914","fe80::200:ff:fe00:51","fe80::200:ff:fe00:2","TCP","644","49153  >  8080 [ACK] Seq=49313 Ack=1 Win=131072 Len=536 TSval=66733 TSecr=66732"
"11429","66.956663","fe80::200:ff:fe00:51","fe80::200:ff:fe00:2","TCP","644","49153  >  8080 [ACK] Seq=49849 Ack=1 Win=131072 Len=536 TSval=66746 TSecr=66745"
"11431","66.962572","fe80::200:ff:fe00:51","fe80::200:ff:fe00:2","TCP","644","49153  >  8080 [ACK] Seq=50385 Ack=1 Win=131072 Len=536 TSval=66746 TSecr=66745"
"11441","66.976559","fe80::200:ff:fe00:51","fe80::200:ff:fe00:2","TCP","644","49153  >  8080 [ACK] Seq=50921 Ack=1 Win=131072 Len=536 TSval=66746 TSecr=66745"
"11443","66.982648","fe80::200:ff:fe00:51","fe80::200:ff:fe00:2","TCP","644","49153  >  8080 [ACK] Seq=51457 Ack=1 Win=131072 Len=536 TSval=66759 TSecr=66758"
"11447","66.989645","fe80::200:ff:fe00:51","fe80::200:ff:fe00:2","TCP","644","49153  >  8080 [ACK] Seq=51993 Ack=1 Win=131072 Len=536 TSval=66759 TSecr=66758"
"11449","66.995554","fe80::200:ff:fe00:51","fe80::200:ff:fe00:2","TCP","644","49153  >  8080 [ACK] Seq=52529 Ack=1 Win=131072 Len=536 TSval=66759 TSecr=66758"
"11453","67.002330","fe80::200:ff:fe00:51","fe80::200:ff:fe00:2","TCP","644","49153  >  8080 [ACK] Seq=53065 Ack=1 Win=131072 Len=536 TSval=66776 TSecr=66775"
"11661","67.338271","fe80::200:ff:fe00:51","fe80::200:ff:fe00:2","TCP","644","49153  >  8080 [ACK] Seq=53601 Ack=1 Win=131072 Len=536 TSval=66776 TSecr=66775"
"11663","67.344360","fe80::200:ff:fe00:51","fe80::200:ff:fe00:2","TCP","644","[TCP Previous segment not captured] 49153  >  8080 [ACK] Seq=61105 Ack=1 Win=131072 Len=536 TSval=66840 TSecr=66839"
"11667","67.351157","fe80::200:ff:fe00:51","fe80::200:ff:fe00:2","TCP","644","[TCP Previous segment not captured] 49153  >  8080 [ACK] Seq=62713 Ack=1 Win=131072 Len=536 TSval=66853 TSecr=66851"
"11669","67.356886","fe80::200:ff:fe00:51","fe80::200:ff:fe00:2","TCP","644","49153  >  8080 [ACK] Seq=63249 Ack=1 Win=131072 Len=536 TSval=66853 TSecr=66851"
"11671","67.362855","fe80::200:ff:fe00:51","fe80::200:ff:fe00:2","TCP","644","[TCP Previous segment not captured] 49153  >  8080 [ACK] Seq=64321 Ack=1 Win=131072 Len=536 TSval=66861 TSecr=66860"
"11675","67.369852","fe80::200:ff:fe00:51","fe80::200:ff:fe00:2","TCP","644","[TCP Previous segment not captured] 49153  >  8080 [ACK] Seq=65929 Ack=1 Win=131072 Len=536 TSval=66880 TSecr=66879"
"11679","67.376709","fe80::200:ff:fe00:51","fe80::200:ff:fe00:2","TCP","644","49153  >  8080 [ACK] Seq=66465 Ack=1 Win=131072 Len=536 TSval=66880 TSecr=66879"
"11681","67.382518","fe80::200:ff:fe00:51","fe80::200:ff:fe00:2","TCP","644","49153  >  8080 [ACK] Seq=67001 Ack=1 Win=131072 Len=536 TSval=66880 TSecr=66879"
"11686","67.395409","fe80::200:ff:fe00:51","fe80::200:ff:fe00:2","TCP","644","49153  >  8080 [ACK] Seq=67537 Ack=1 Win=131072 Len=536 TSval=66899 TSecr=66893"
"11688","67.401678","fe80::200:ff:fe00:51","fe80::200:ff:fe00:2","TCP","644","49153  >  8080 [ACK] Seq=68073 Ack=1 Win=131072 Len=536 TSval=66899 TSecr=66893"
"11692","67.408575","fe80::200:ff:fe00:51","fe80::200:ff:fe00:2","TCP","644","[TCP Previous segment not captured] 49153  >  8080 [ACK] Seq=69145 Ack=1 Win=131072 Len=536 TSval=66938 TSecr=66912"
"11694","67.414424","fe80::200:ff:fe00:51","fe80::200:ff:fe00:2","TCP","644","49153  >  8080 [ACK] Seq=69681 Ack=1 Win=131072 Len=536 TSval=66938 TSecr=66912"
"11696","67.420332","fe80::200:ff:fe00:51","fe80::200:ff:fe00:2","TCP","644","49153  >  8080 [ACK] Seq=70217 Ack=1 Win=131072 Len=536 TSval=66938 TSecr=66912"
"11700","67.427289","fe80::200:ff:fe00:51","fe80::200:ff:fe00:2","TCP","644","49153  >  8080 [ACK] Seq=70753 Ack=1 Win=131072 Len=536 TSval=66945 TSecr=66925"
"11704","67.431790","fe80::200:ff:fe00:51","fe80::200:ff:fe00:2","TCP","644","49153  >  8080 [ACK] Seq=71289 Ack=1 Win=131072 Len=536 TSval=66945 TSecr=66925"
"11722","67.462094","fe80::200:ff:fe00:51","fe80::200:ff:fe00:2","TCP","644","49153  >  8080 [ACK] Seq=71825 Ack=1 Win=131072 Len=536 TSval=66945 TSecr=66925"
"11726","67.468991","fe80::200:ff:fe00:51","fe80::200:ff:fe00:2","TCP","644","49153  >  8080 [ACK] Seq=72361 Ack=1 Win=131072 Len=536 TSval=66965 TSecr=66937"
"11730","67.476108","fe80::200:ff:fe00:51","fe80::200:ff:fe00:2","TCP","644","[TCP Previous segment not captured] 49153  >  8080 [ACK] Seq=77185 Ack=1 Win=131072 Len=536 TSval=66983 TSecr=66982"
"11734","67.483065","fe80::200:ff:fe00:51","fe80::200:ff:fe00:2","TCP","644","49153  >  8080 [ACK] Seq=77721 Ack=1 Win=131072 Len=536 TSval=66983 TSecr=66982"
"11737","67.490322","fe80::200:ff:fe00:51","fe80::200:ff:fe00:2","TCP","644","[TCP Previous segment not captured] 49153  >  8080 [ACK] Seq=78793 Ack=1 Win=131072 Len=536 TSval=66996 TSecr=66995"
"11740","67.502625","fe80::200:ff:fe00:51","fe80::200:ff:fe00:2","TCP","644","49153  >  8080 [ACK] Seq=79329 Ack=1 Win=131072 Len=536 TSval=66996 TSecr=66995"
"11756","67.525879","fe80::200:ff:fe00:51","fe80::200:ff:fe00:2","TCP","644","[TCP Previous segment not captured] 49153  >  8080 [ACK] Seq=80401 Ack=1 Win=131072 Len=536 TSval=67327 TSecr=67202"
"11760","67.533468","fe80::200:ff:fe00:51","fe80::200:ff:fe00:2","TCP","644","49153  >  8080 [ACK] Seq=80937 Ack=1 Win=131072 Len=536 TSval=67327 TSecr=67202"
"11764","67.540657","fe80::200:ff:fe00:51","fe80::200:ff:fe00:2","TCP","644","49153  >  8080 [ACK] Seq=81473 Ack=1 Win=131072 Len=536 TSval=67345 TSecr=67344"
"11768","67.548386","fe80::200:ff:fe00:51","fe80::200:ff:fe00:2","TCP","644","49153  >  8080 [ACK] Seq=82009 Ack=1 Win=131072 Len=536 TSval=67345 TSecr=67344"
"11772","67.555575","fe80::200:ff:fe00:51","fe80::200:ff:fe00:2","TCP","644","49153  >  8080 [ACK] Seq=82545 Ack=1 Win=131072 Len=536 TSval=67364 TSecr=67351"
"11777","67.569579","fe80::200:ff:fe00:51","fe80::200:ff:fe00:2","TCP","644","49153  >  8080 [ACK] Seq=83081 Ack=1 Win=131072 Len=536 TSval=67371 TSecr=67357"
"11781","67.577068","fe80::200:ff:fe00:51","fe80::200:ff:fe00:2","TCP","644","[TCP Fast Retransmission] 49153  >  8080 [ACK] Seq=54137 Ack=1 Win=131072 Len=536 TSval=67383 TSecr=67363"
"11785","67.587815","fe80::200:ff:fe00:51","fe80::200:ff:fe00:2","TCP","644","[TCP Retransmission] 49153  >  8080 [ACK] Seq=54673 Ack=1 Win=131072 Len=536 TSval=67578 TSecr=67577"
"11789","67.595244","fe80::200:ff:fe00:51","fe80::200:ff:fe00:2","TCP","644","[TCP Retransmission] 49153  >  8080 [ACK] Seq=55209 Ack=1 Win=131072 Len=536 TSval=67589 TSecr=67587"
"11793","67.602633","fe80::200:ff:fe00:51","fe80::200:ff:fe00:2","TCP","644","[TCP Retransmission] 49153  >  8080 [ACK] Seq=55745 Ack=1 Win=131072 Len=536 TSval=67597 TSecr=67595"
"11797","67.610302","fe80::200:ff:fe00:51","fe80::200:ff:fe00:2","TCP","644","[TCP Retransmission] 49153  >  8080 [ACK] Seq=56281 Ack=1 Win=131072 Len=536 TSval=67604 TSecr=67602"
"11801","67.617519","fe80::200:ff:fe00:51","fe80::200:ff:fe00:2","TCP","644","[TCP Retransmission] 49153  >  8080 [ACK] Seq=56817 Ack=1 Win=131072 Len=536 TSval=67611 TSecr=67610"
"11805","67.624256","fe80::200:ff:fe00:51","fe80::200:ff:fe00:2","TCP","644","49153  >  8080 [ACK] Seq=83617 Ack=1 Win=131072 Len=536 TSval=67611 TSecr=67610"
"11809","67.631493","fe80::200:ff:fe00:51","fe80::200:ff:fe00:2","TCP","644","[TCP Retransmission] 49153  >  8080 [ACK] Seq=57353 Ack=1 Win=131072 Len=536 TSval=67618 TSecr=67617"
"11813","67.638690","fe80::200:ff:fe00:51","fe80::200:ff:fe00:2","TCP","644","49153  >  8080 [ACK] Seq=84153 Ack=1 Win=131072 Len=536 TSval=67618 TSecr=67617"
"11817","67.645907","fe80::200:ff:fe00:51","fe80::200:ff:fe00:2","TCP","644","49153  >  8080 [ACK] Seq=84689 Ack=1 Win=131072 Len=536 TSval=67625 TSecr=67624"
"11821","67.652863","fe80::200:ff:fe00:51","fe80::200:ff:fe00:2","TCP","644","[TCP Fast Retransmission] 49153  >  8080 [ACK] Seq=57889 Ack=1 Win=131072 Len=536 TSval=67632 TSecr=67631"
"11826","67.664461","fe80::200:ff:fe00:51","fe80::200:ff:fe00:2","TCP","644","49153  >  8080 [ACK] Seq=85225 Ack=1 Win=131072 Len=536 TSval=67632 TSecr=67631"
"11831","67.677793","fe80::200:ff:fe00:51","fe80::200:ff:fe00:2","TCP","644","49153  >  8080 [ACK] Seq=85761 Ack=1 Win=131072 Len=536 TSval=67639 TSecr=67638"
"11835","67.684870","fe80::200:ff:fe00:51","fe80::200:ff:fe00:2","TCP","644","49153  >  8080 [ACK] Seq=86297 Ack=1 Win=131072 Len=536 TSval=67647 TSecr=67646"
"11839","67.692067","fe80::200:ff:fe00:51","fe80::200:ff:fe00:2","TCP","644","[TCP Fast Retransmission] 49153  >  8080 [ACK] Seq=58425 Ack=1 Win=131072 Len=536 TSval=67658 TSecr=67653"
"11843","67.698824","fe80::200:ff:fe00:51","fe80::200:ff:fe00:2","TCP","644","49153  >  8080 [ACK] Seq=86833 Ack=1 Win=131072 Len=536 TSval=67658 TSecr=67653"
"11845","67.704553","fe80::200:ff:fe00:51","fe80::200:ff:fe00:2","TCP","644","49153  >  8080 [ACK] Seq=87369 Ack=1 Win=131072 Len=536 TSval=67671 TSecr=67664"
"11853","67.719154","fe80::200:ff:fe00:51","fe80::200:ff:fe00:2","TCP","644","49153  >  8080 [ACK] Seq=87905 Ack=1 Win=131072 Len=536 TSval=67678 TSecr=67677"
"11857","67.726231","fe80::200:ff:fe00:51","fe80::200:ff:fe00:2","TCP","644","49153  >  8080 [ACK] Seq=88441 Ack=1 Win=131072 Len=536 TSval=67686 TSecr=67685"
"11861","67.733148","fe80::200:ff:fe00:51","fe80::200:ff:fe00:2","TCP","644","[TCP Fast Retransmission] 49153  >  8080 [ACK] Seq=58961 Ack=1 Win=131072 Len=536 TSval=67693 TSecr=67692"
"11865","67.740285","fe80::200:ff:fe00:51","fe80::200:ff:fe00:2","TCP","644","49153  >  8080 [ACK] Seq=88977 Ack=1 Win=131072 Len=536 TSval=67693 TSecr=67692"
"11868","67.747202","fe80::200:ff:fe00:51","fe80::200:ff:fe00:2","TCP","644","49153  >  8080 [ACK] Seq=89513 Ack=1 Win=131072 Len=536 TSval=67711 TSecr=67698"
"11870","67.753491","fe80::200:ff:fe00:51","fe80::200:ff:fe00:2","TCP","644","49153  >  8080 [ACK] Seq=90049 Ack=1 Win=131072 Len=536 TSval=67713 TSecr=67704"
"11874","67.760767","fe80::200:ff:fe00:51","fe80::200:ff:fe00:2","TCP","644","49153  >  8080 [ACK] Seq=90585 Ack=1 Win=131072 Len=536 TSval=67720 TSecr=67719"
"11878","67.765248","fe80::200:ff:fe00:51","fe80::200:ff:fe00:2","TCP","644","49153  >  8080 [ACK] Seq=91121 Ack=1 Win=131072 Len=536 TSval=67727 TSecr=67726"
"11882","67.769609","fe80::200:ff:fe00:51","fe80::200:ff:fe00:2","TCP","644","[TCP Fast Retransmission] 49153  >  8080 [ACK] Seq=59497 Ack=1 Win=131072 Len=536 TSval=67734 TSecr=67733"
"11886","67.774050","fe80::200:ff:fe00:51","fe80::200:ff:fe00:2","TCP","644","49153  >  8080 [ACK] Seq=91657 Ack=1 Win=131072 Len=536 TSval=67734 TSecr=67733"
"11890","67.778451","fe80::200:ff:fe00:51","fe80::200:ff:fe00:2","TCP","644","49153  >  8080 [ACK] Seq=92193 Ack=1 Win=131072 Len=536 TSval=67754 TSecr=67740"
"11894","67.783012","fe80::200:ff:fe00:51","fe80::200:ff:fe00:2","TCP","644","49153  >  8080 [ACK] Seq=92729 Ack=1 Win=131072 Len=536 TSval=67762 TSecr=67747"
"11896","67.786185","fe80::200:ff:fe00:51","fe80::200:ff:fe00:2","TCP","644","49153  >  8080 [ACK] Seq=93265 Ack=1 Win=131072 Len=536 TSval=67766 TSecr=67753"
"11900","67.790846","fe80::200:ff:fe00:51","fe80::200:ff:fe00:2","TCP","644","49153  >  8080 [ACK] Seq=93801 Ack=1 Win=131072 Len=536 TSval=67771 TSecr=67760"
"11906","67.799394","fe80::200:ff:fe00:51","fe80::200:ff:fe00:2","TCP","644","49153  >  8080 [ACK] Seq=94337 Ack=1 Win=131072 Len=536 TSval=67775 TSecr=67765"
"12796","69.278417","fe80::200:ff:fe00:51","fe80::200:ff:fe00:2","TCP","644","[TCP Retransmission] 49153  >  8080 [ACK] Seq=60033 Ack=1 Win=131072 Len=536 TSval=67779 TSecr=67769"
"12892","69.375350","fe80::200:ff:fe00:51","fe80::200:ff:fe00:2","TCP","644","[TCP Retransmission] 49153  >  8080 [ACK] Seq=60569 Ack=1 Win=131072 Len=536 TSval=69369 TSecr=69278"
"12894","69.381399","fe80::200:ff:fe00:51","fe80::200:ff:fe00:2","TCP","644","[TCP Retransmission] 49153  >  8080 [ACK] Seq=61105 Ack=1 Win=131072 Len=536 TSval=69369 TSecr=69278"
"12900","69.390549","fe80::200:ff:fe00:51","fe80::200:ff:fe00:2","TCP","644","[TCP Retransmission] 49153  >  8080 [ACK] Seq=61641 Ack=1 Win=131072 Len=536 TSval=69384 TSecr=69375"
"12906","69.399298","fe80::200:ff:fe00:51","fe80::200:ff:fe00:2","TCP","644","[TCP Retransmission] 49153  >  8080 [ACK] Seq=62177 Ack=1 Win=131072 Len=536 TSval=69384 TSecr=69375"
"12910","69.406887","fe80::200:ff:fe00:51","fe80::200:ff:fe00:2","TCP","644","[TCP Spurious Retransmission] 49153  >  8080 [ACK] Seq=62713 Ack=1 Win=131072 Len=536 TSval=69384 TSecr=69375"
"12914","69.414056","fe80::200:ff:fe00:51","fe80::200:ff:fe00:2","TCP","644","[TCP Spurious Retransmission] 49153  >  8080 [ACK] Seq=63249 Ack=1 Win=131072 Len=536 TSval=69392 TSecr=69381"
"12916","69.419805","fe80::200:ff:fe00:51","fe80::200:ff:fe00:2","TCP","644","[TCP Retransmission] 49153  >  8080 [ACK] Seq=63785 Ack=1 Win=131072 Len=536 TSval=69393 TSecr=69390"
"12918","69.425874","fe80::200:ff:fe00:51","fe80::200:ff:fe00:2","TCP","644","[TCP Retransmission] 49153  >  8080 [ACK] Seq=64321 Ack=1 Win=131072 Len=536 TSval=69400 TSecr=69399"
"12922","69.433283","fe80::200:ff:fe00:51","fe80::200:ff:fe00:2","TCP","644","[TCP Retransmission] 49153  >  8080 [ACK] Seq=64857 Ack=1 Win=131072 Len=536 TSval=69400 TSecr=69399"
"12928","69.445666","fe80::200:ff:fe00:51","fe80::200:ff:fe00:2","TCP","644","[TCP Retransmission] 49153  >  8080 [ACK] Seq=65393 Ack=1 Win=131072 Len=536 TSval=69400 TSecr=69399"
"12932","69.452683","fe80::200:ff:fe00:51","fe80::200:ff:fe00:2","TCP","644","[TCP Retransmission] 49153  >  8080 [ACK] Seq=65929 Ack=1 Win=131072 Len=536 TSval=69400 TSecr=69399"
"12938","69.460769","fe80::200:ff:fe00:51","fe80::200:ff:fe00:2","TCP","644","[TCP Spurious Retransmission] 49153  >  8080 [ACK] Seq=66465 Ack=1 Win=131072 Len=536 TSval=69408 TSecr=69407"
"12942","69.467706","fe80::200:ff:fe00:51","fe80::200:ff:fe00:2","TCP","644","[TCP Spurious Retransmission] 49153  >  8080 [ACK] Seq=67001 Ack=1 Win=131072 Len=536 TSval=69427 TSecr=69414"
"12946","69.474622","fe80::200:ff:fe00:51","fe80::200:ff:fe00:2","TCP","644","[TCP Spurious Retransmission] 49153  >  8080 [ACK] Seq=67537 Ack=1 Win=131072 Len=536 TSval=69438 TSecr=69419"
"12950","69.481719","fe80::200:ff:fe00:51","fe80::200:ff:fe00:2","TCP","644","[TCP Spurious Retransmission] 49153  >  8080 [ACK] Seq=68073 Ack=1 Win=131072 Len=536 TSval=69439 TSecr=69426"
"12952","69.487548","fe80::200:ff:fe00:51","fe80::200:ff:fe00:2","TCP","644","[TCP Fast Retransmission] 49153  >  8080 [ACK] Seq=68609 Ack=1 Win=131072 Len=536 TSval=69446 TSecr=69433"
"12956","69.494505","fe80::200:ff:fe00:51","fe80::200:ff:fe00:2","TCP","644","[TCP Retransmission] 49153  >  8080 [ACK] Seq=69145 Ack=1 Win=131072 Len=536 TSval=69454 TSecr=69445"
"12962","69.502771","fe80::200:ff:fe00:51","fe80::200:ff:fe00:2","TCP","644","[TCP Spurious Retransmission] 49153  >  8080 [ACK] Seq=69681 Ack=1 Win=131072 Len=536 TSval=69454 TSecr=69445"
"12965","69.509748","fe80::200:ff:fe00:51","fe80::200:ff:fe00:2","TCP","644","[TCP Spurious Retransmission] 49153  >  8080 [ACK] Seq=70217 Ack=1 Win=131072 Len=536 TSval=69454 TSecr=69445"
"12967","69.513121","fe80::200:ff:fe00:51","fe80::200:ff:fe00:2","TCP","644","[TCP Spurious Retransmission] 49153  >  8080 [ACK] Seq=70753 Ack=1 Win=131072 Len=536 TSval=69454 TSecr=69445"
"12969","69.516634","fe80::200:ff:fe00:51","fe80::200:ff:fe00:2","TCP","644","[TCP Spurious Retransmission] 49153  >  8080 [ACK] Seq=71289 Ack=1 Win=131072 Len=536 TSval=69454 TSecr=69445"
"12979","69.534662","fe80::200:ff:fe00:51","fe80::200:ff:fe00:2","TCP","644","[TCP Spurious Retransmission] 49153  >  8080 [ACK] Seq=71825 Ack=1 Win=131072 Len=536 TSval=69454 TSecr=69445"
"12983","69.541518","fe80::200:ff:fe00:51","fe80::200:ff:fe00:2","TCP","644","[TCP Spurious Retransmission] 49153  >  8080 [ACK] Seq=72361 Ack=1 Win=131072 Len=536 TSval=69454 TSecr=69445"
"12986","69.548421","fe80::200:ff:fe00:51","fe80::200:ff:fe00:2","TCP","644","[TCP Fast Retransmission] 49153  >  8080 [ACK] Seq=72897 Ack=1 Win=131072 Len=536 TSval=69455 TSecr=69452"
"12990","69.555258","fe80::200:ff:fe00:51","fe80::200:ff:fe00:2","TCP","644","[TCP Retransmission] 49153  >  8080 [ACK] Seq=73433 Ack=1 Win=131072 Len=536 TSval=69462 TSecr=69460"
"12996","69.563244","fe80::200:ff:fe00:51","fe80::200:ff:fe00:2","TCP","644","[TCP Retransmission] 49153  >  8080 [ACK] Seq=73969 Ack=1 Win=131072 Len=536 TSval=69469 TSecr=69467"
"13000","69.570261","fe80::200:ff:fe00:51","fe80::200:ff:fe00:2","TCP","644","[TCP Retransmission] 49153  >  8080 [ACK] Seq=74505 Ack=1 Win=131072 Len=536 TSval=69475 TSecr=69474"
"13002","69.576110","fe80::200:ff:fe00:51","fe80::200:ff:fe00:2","TCP","644","[TCP Retransmission] 49153  >  8080 [ACK] Seq=75041 Ack=1 Win=131072 Len=536 TSval=69488 TSecr=69481"
"13008","69.584396","fe80::200:ff:fe00:51","fe80::200:ff:fe00:2","TCP","644","[TCP Retransmission] 49153  >  8080 [ACK] Seq=75577 Ack=1 Win=131072 Len=536 TSval=69496 TSecr=69487"
"13012","69.591673","fe80::200:ff:fe00:51","fe80::200:ff:fe00:2","TCP","644","[TCP Retransmission] 49153  >  8080 [ACK] Seq=76113 Ack=1 Win=131072 Len=536 TSval=69496 TSecr=69487"
"13016","69.598750","fe80::200:ff:fe00:51","fe80::200:ff:fe00:2","TCP","644","[TCP Retransmission] 49153  >  8080 [ACK] Seq=76649 Ack=1 Win=131072 Len=536 TSval=69496 TSecr=69487"
"13018","69.607917","fe80::200:ff:fe00:51","fe80::200:ff:fe00:2","TCP","644","[TCP Retransmission] 49153  >  8080 [ACK] Seq=77185 Ack=1 Win=131072 Len=536 TSval=69496 TSecr=69487"
"13022","69.614653","fe80::200:ff:fe00:51","fe80::200:ff:fe00:2","TCP","644","[TCP Spurious Retransmission] 49153  >  8080 [ACK] Seq=77721 Ack=1 Win=131072 Len=536 TSval=69497 TSecr=69494"
"13024","69.620482","fe80::200:ff:fe00:51","fe80::200:ff:fe00:2","TCP","644","[TCP Retransmission] 49153  >  8080 [ACK] Seq=78257 Ack=1 Win=131072 Len=536 TSval=69517 TSecr=69502"
"13028","69.627399","fe80::200:ff:fe00:51","fe80::200:ff:fe00:2","TCP","644","[TCP Retransmission] 49153  >  8080 [ACK] Seq=78793 Ack=1 Win=131072 Len=536 TSval=69518 TSecr=69509"
"13030","69.633388","fe80::200:ff:fe00:51","fe80::200:ff:fe00:2","TCP","644","[TCP Retransmission] 49153  >  8080 [ACK] Seq=79329 Ack=1 Win=131072 Len=536 TSval=69523 TSecr=69513"
"13033","69.640011","fe80::200:ff:fe00:51","fe80::200:ff:fe00:2","TCP","644","[TCP Retransmission] 49153  >  8080 [ACK] Seq=79865 Ack=1 Win=131072 Len=536 TSval=69528 TSecr=69516"
"13035","69.646300","fe80::200:ff:fe00:51","fe80::200:ff:fe00:2","TCP","644","[TCP Retransmission] 49153  >  8080 [ACK] Seq=80401 Ack=1 Win=131072 Len=536 TSval=69535 TSecr=69534"
"13037","69.652109","fe80::200:ff:fe00:51","fe80::200:ff:fe00:2","TCP","644","[TCP Retransmission] 49153  >  8080 [ACK] Seq=80937 Ack=1 Win=131072 Len=536 TSval=69549 TSecr=69541"
"13039","69.657998","fe80::200:ff:fe00:51","fe80::200:ff:fe00:2","TCP","644","[TCP Retransmission] 49153  >  8080 [ACK] Seq=81473 Ack=1 Win=131072 Len=536 TSval=69577 TSecr=69570"
"13043","69.665135","fe80::200:ff:fe00:51","fe80::200:ff:fe00:2","TCP","644","[TCP Retransmission] 49153  >  8080 [ACK] Seq=82009 Ack=1 Win=131072 Len=536 TSval=69578 TSecr=69576"
"13047","69.669696","fe80::200:ff:fe00:51","fe80::200:ff:fe00:2","TCP","644","[TCP Retransmission] 49153  >  8080 [ACK] Seq=82545 Ack=1 Win=131072 Len=536 TSval=69578 TSecr=69576"
"13049","69.673109","fe80::200:ff:fe00:51","fe80::200:ff:fe00:2","TCP","644","[TCP Retransmission] 49153  >  8080 [ACK] Seq=83081 Ack=1 Win=131072 Len=536 TSval=69585 TSecr=69584"
"13059","69.684508","fe80::200:ff:fe00:51","fe80::200:ff:fe00:2","TCP","644","[TCP Spurious Retransmission] 49153  >  8080 [ACK] Seq=83617 Ack=1 Win=131072 Len=536 TSval=69585 TSecr=69584"
"13061","69.687741","fe80::200:ff:fe00:51","fe80::200:ff:fe00:2","TCP","644","[TCP Spurious Retransmission] 49153  >  8080 [ACK] Seq=84153 Ack=1 Win=131072 Len=536 TSval=69593 TSecr=69591"
"13063","69.691034","fe80::200:ff:fe00:51","fe80::200:ff:fe00:2","TCP","644","[TCP Spurious Retransmission] 49153  >  8080 [ACK] Seq=84689 Ack=1 Win=131072 Len=536 TSval=69593 TSecr=69591"
"13065","69.694167","fe80::200:ff:fe00:51","fe80::200:ff:fe00:2","TCP","644","[TCP Spurious Retransmission] 49153  >  8080 [ACK] Seq=85225 Ack=1 Win=131072 Len=536 TSval=69609 TSecr=69598"
"13071","69.703429","fe80::200:ff:fe00:51","fe80::200:ff:fe00:2","TCP","644","[TCP Spurious Retransmission] 49153  >  8080 [ACK] Seq=85761 Ack=1 Win=131072 Len=536 TSval=69609 TSecr=69598"
"13075","69.707830","fe80::200:ff:fe00:51","fe80::200:ff:fe00:2","TCP","644","[TCP Spurious Retransmission] 49153  >  8080 [ACK] Seq=86297 Ack=1 Win=131072 Len=536 TSval=69609 TSecr=69598"
"13079","69.712411","fe80::200:ff:fe00:51","fe80::200:ff:fe00:2","TCP","644","[TCP Spurious Retransmission] 49153  >  8080 [ACK] Seq=86833 Ack=1 Win=131072 Len=536 TSval=69609 TSecr=69598"
"13081","69.715584","fe80::200:ff:fe00:51","fe80::200:ff:fe00:2","TCP","644","[TCP Spurious Retransmission] 49153  >  8080 [ACK] Seq=87369 Ack=1 Win=131072 Len=536 TSval=69621 TSecr=69608"
"13084","69.723129","fe80::200:ff:fe00:51","fe80::200:ff:fe00:2","TCP","644","[TCP Spurious Retransmission] 49153  >  8080 [ACK] Seq=87905 Ack=1 Win=131072 Len=536 TSval=69659 TSecr=69614"
"13086","69.726782","fe80::200:ff:fe00:51","fe80::200:ff:fe00:2","TCP","644","[TCP Spurious Retransmission] 49153  >  8080 [ACK] Seq=88441 Ack=1 Win=131072 Len=536 TSval=69666 TSecr=69620"
"13100","69.738661","fe80::200:ff:fe00:51","fe80::200:ff:fe00:2","TCP","644","[TCP Spurious Retransmission] 49153  >  8080 [ACK] Seq=88977 Ack=1 Win=131072 Len=536 TSval=69666 TSecr=69620"
"13102","69.742014","fe80::200:ff:fe00:51","fe80::200:ff:fe00:2","TCP","644","[TCP Spurious Retransmission] 49153  >  8080 [ACK] Seq=89513 Ack=1 Win=131072 Len=536 TSval=69674 TSecr=69627"
"13104","69.745267","fe80::200:ff:fe00:51","fe80::200:ff:fe00:2","TCP","644","[TCP Spurious Retransmission] 49153  >  8080 [ACK] Seq=90049 Ack=1 Win=131072 Len=536 TSval=69675 TSecr=69633"
"13108","69.749728","fe80::200:ff:fe00:51","fe80::200:ff:fe00:2","TCP","644","49153  >  8080 [ACK] Seq=94873 Ack=1 Win=131072 Len=536 TSval=69680 TSecr=69640"
"13112","69.754049","fe80::200:ff:fe00:51","fe80::200:ff:fe00:2","TCP","644","49153  >  8080 [ACK] Seq=95409 Ack=1 Win=131072 Len=536 TSval=69680 TSecr=69640"
"13118","69.759738","fe80::200:ff:fe00:51","fe80::200:ff:fe00:2","TCP","644","49153  >  8080 [ACK] Seq=95945 Ack=1 Win=131072 Len=536 TSval=69680 TSecr=69640"
"13121","69.763905","fe80::200:ff:fe00:51","fe80::200:ff:fe00:2","TCP","644","49153  >  8080 [ACK] Seq=96481 Ack=1 Win=131072 Len=536 TSval=69680 TSecr=69640"
"13125","69.768406","fe80::200:ff:fe00:51","fe80::200:ff:fe00:2","TCP","644","49153  >  8080 [ACK] Seq=97017 Ack=1 Win=131072 Len=536 TSval=69680 TSecr=69640"
"13127","69.771699","fe80::200:ff:fe00:51","fe80::200:ff:fe00:2","TCP","644","49153  >  8080 [ACK] Seq=97553 Ack=1 Win=131072 Len=536 TSval=69680 TSecr=69640"
"13129","69.774912","fe80::200:ff:fe00:51","fe80::200:ff:fe00:2","TCP","644","49153  >  8080 [ACK] Seq=98089 Ack=1 Win=131072 Len=536 TSval=69680 TSecr=69640"
"13143","69.790744","fe80::200:ff:fe00:51","fe80::200:ff:fe00:2","TCP","644","49153  >  8080 [ACK] Seq=98625 Ack=1 Win=131072 Len=536 TSval=69680 TSecr=69640"
"13147","69.795464","fe80::200:ff:fe00:51","fe80::200:ff:fe00:2","TCP","644","49153  >  8080 [ACK] Seq=99161 Ack=1 Win=131072 Len=536 TSval=69680 TSecr=69640"
"13149","69.799057","fe80::200:ff:fe00:51","fe80::200:ff:fe00:2","TCP","644","49153  >  8080 [ACK] Seq=99697 Ack=1 Win=131072 Len=536 TSval=69680 TSecr=69640"
"13400","70.190167","fe80::200:ff:fe00:51","fe80::200:ff:fe00:2","TCP","644","49153  >  8080 [ACK] Seq=100233 Ack=1 Win=131072 Len=536 TSval=69680 TSecr=69640"
"13403","70.197416","fe80::200:ff:fe00:51","fe80::200:ff:fe00:2","TCP","644","[TCP Previous segment not captured] 49153  >  8080 [ACK] Seq=105593 Ack=1 Win=131072 Len=536 TSval=69695 TSecr=69652"
"13406","70.204563","fe80::200:ff:fe00:51","fe80::200:ff:fe00:2","TCP","644","49153  >  8080 [ACK] Seq=106129 Ack=1 Win=131072 Len=536 TSval=69699 TSecr=69658"
"13412","70.214569","fe80::200:ff:fe00:51","fe80::200:ff:fe00:2","TCP","644","[TCP Previous segment not captured] 49153  >  8080 [ACK] Seq=107737 Ack=1 Win=131072 Len=536 TSval=69729 TSecr=69673"
"13416","70.223474","fe80::200:ff:fe00:51","fe80::200:ff:fe00:2","TCP","644","49153  >  8080 [ACK] Seq=108273 Ack=1 Win=131072 Len=536 TSval=69730 TSecr=69684"
"13422","70.232304","fe80::200:ff:fe00:51","fe80::200:ff:fe00:2","TCP","644","49153  >  8080 [ACK] Seq=108809 Ack=1 Win=131072 Len=536 TSval=69732 TSecr=69687"
"13424","70.238333","fe80::200:ff:fe00:51","fe80::200:ff:fe00:2","TCP","644","49153  >  8080 [ACK] Seq=109345 Ack=1 Win=131072 Len=536 TSval=69733 TSecr=69691"
"13430","70.247223","fe80::200:ff:fe00:51","fe80::200:ff:fe00:2","TCP","644","[TCP Previous segment not captured] 49153  >  8080 [ACK] Seq=110953 Ack=1 Win=131072 Len=536 TSval=69746 TSecr=69708"
"13434","70.256027","fe80::200:ff:fe00:51","fe80::200:ff:fe00:2","TCP","644","49153  >  8080 [ACK] Seq=111489 Ack=1 Win=131072 Len=536 TSval=69750 TSecr=69712"
