"No.","Time","Source","Destination","Protocol","Length","Info"
"1491","23.191905","fe80::200:ff:fe00:51","fe80::200:ff:fe00:2","TCP","112","49153  >  8080 [SYN] Seq=0 Win=32768 Len=0 WS=4 TSval=23000 TSecr=0"
"2091","24.252951","fe80::200:ff:fe00:36","fe80::200:ff:fe00:51","ICMPv6","160","Destination Unreachable (no route to destination)"
"3137","28.998874","fe80::200:ff:fe00:51","fe80::200:ff:fe00:2","TCP","112","[TCP Retransmission] 49153  >  8080 [SYN] Seq=0 Win=32768 Len=0 WS=4 TSval=29000 TSecr=0"
"3151","29.022721","fe80::200:ff:fe00:36","fe80::200:ff:fe00:51","ICMPv6","160","Destination Unreachable (no route to destination)"
"6214","40.998874","fe80::200:ff:fe00:51","fe80::200:ff:fe00:2","TCP","112","[TCP Retransmission] 49153  >  8080 [SYN] Seq=0 Win=32768 Len=0 WS=4 TSval=41000 TSecr=0"
"6279","41.115245","fe80::200:ff:fe00:51","fe80::200:ff:fe00:2","TCP","112","[TCP Retransmission] 49153  >  8080 [SYN] Seq=0 Win=32768 Len=0 WS=4 TSval=41000 TSecr=0"
"6554","41.594102","fe80::200:ff:fe00:36","fe80::200:ff:fe00:51","ICMPv6","160","Destination Unreachable (no route to destination)"
"10096","66.275143","fe80::200:ff:fe00:51","fe80::200:ff:fe00:2","TCP","112","[TCP Retransmission] 49153  >  8080 [SYN] Seq=0 Win=32768 Len=0 WS=4 TSval=65000 TSecr=0"
"10106","66.288406","fe80::200:ff:fe00:51","fe80::200:ff:fe00:2","TCP","112","[TCP Retransmission] 49153  >  8080 [SYN] Seq=0 Win=32768 Len=0 WS=4 TSval=65000 TSecr=0"
"10111","66.293212","fe80::200:ff:fe00:51","fe80::200:ff:fe00:2","TCP","108","49153  >  8080 [ACK] Seq=1 Ack=1 Win=131072 Len=0 TSval=66293 TSecr=66290"
"10114","66.296613","fe80::200:ff:fe00:51","fe80::200:ff:fe00:2","TCP","644","49153  >  8080 [ACK] Seq=1 Ack=1 Win=131072 Len=536 TSval=66293 TSecr=66290"
"10115","66.302927","fe80::200:ff:fe00:51","fe80::200:ff:fe00:2","TCP","644","[TCP Retransmission] 49153  >  8080 [ACK] Seq=1 Ack=1 Win=131072 Len=536 TSval=66293 TSecr=66290"
"10119","66.310116","fe80::200:ff:fe00:51","fe80::200:ff:fe00:2","TCP","644","49153  >  8080 [ACK] Seq=537 Ack=1 Win=131072 Len=536 TSval=66310 TSecr=66309"
"10121","66.315905","fe80::200:ff:fe00:51","fe80::200:ff:fe00:2","TCP","644","49153  >  8080 [ACK] Seq=1073 Ack=1 Win=131072 Len=536 TSval=66310 TSecr=66309"
"10125","66.323314","fe80::200:ff:fe00:51","fe80::200:ff:fe00:2","TCP","644","49153  >  8080 [ACK] Seq=1609 Ack=1 Win=131072 Len=536 TSval=66324 TSecr=66322"
"10127","66.329543","fe80::200:ff:fe00:51","fe80::200:ff:fe00:2","TCP","644","49153  >  8080 [ACK] Seq=2145 Ack=1 Win=131072 Len=536 TSval=66324 TSecr=66322"
"10131","66.336852","fe80::200:ff:fe00:51","fe80::200:ff:fe00:2","TCP","644","49153  >  8080 [ACK] Seq=2681 Ack=1 Win=131072 Len=536 TSval=66324 TSecr=66322"
"10133","66.342641","fe80::200:ff:fe00:51","fe80::200:ff:fe00:2","TCP","644","49153  >  8080 [ACK] Seq=3217 Ack=1 Win=131072 Len=536 TSval=66337 TSecr=66336"
"10137","66.350270","fe80::200:ff:fe00:51","fe80::200:ff:fe00:2","TCP","644","49153  >  8080 [ACK] Seq=3753 Ack=1 Win=131072 Len=536 TSval=66337 TSecr=66336"
"10142","66.359377","fe80::200:ff:fe00:51","fe80::200:ff:fe00:2","TCP","644","49153  >  8080 [ACK] Seq=4289 Ack=1 Win=131072 Len=536 TSval=66337 TSecr=66336"
"10147","66.368285","fe80::200:ff:fe00:51","fe80::200:ff:fe00:2","TCP","644","49153  >  8080 [ACK] Seq=4825 Ack=1 Win=131072 Len=536 TSval=66350 TSecr=66349"
"10150","66.375412","fe80::200:ff:fe00:51","fe80::200:ff:fe00:2","TCP","644","49153  >  8080 [ACK] Seq=5361 Ack=1 Win=131072 Len=536 TSval=66350 TSecr=66349"
"10152","66.380922","fe80::200:ff:fe00:51","fe80::200:ff:fe00:2","TCP","644","[TCP Retransmission] 49153  >  8080 [ACK] Seq=5361 Ack=1 Win=131072 Len=536 TSval=66350 TSecr=66349"
"10156","66.388651","fe80::200:ff:fe00:51","fe80::200:ff:fe00:2","TCP","644","49153  >  8080 [ACK] Seq=5897 Ack=1 Win=131072 Len=536 TSval=66350 TSecr=66349"
"10158","66.394840","fe80::200:ff:fe00:51","fe80::200:ff:fe00:2","TCP","644","49153  >  8080 [ACK] Seq=6433 Ack=1 Win=131072 Len=536 TSval=66367 TSecr=66365"
"10162","66.402169","fe80::200:ff:fe00:51","fe80::200:ff:fe00:2","TCP","644","49153  >  8080 [ACK] Seq=6969 Ack=1 Win=131072 Len=536 TSval=66367 TSecr=66365"
"10164","66.408218","fe80::200:ff:fe00:51","fe80::200:ff:fe00:2","TCP","644","49153  >  8080 [ACK] Seq=7505 Ack=1 Win=131072 Len=536 TSval=66367 TSecr=66365"
"10168","66.415947","fe80::200:ff:fe00:51","fe80::200:ff:fe00:2","TCP","644","49153  >  8080 [ACK] Seq=8041 Ack=1 Win=131072 Len=536 TSval=66388 TSecr=66387"
"10170","66.421956","fe80::200:ff:fe00:51","fe80::200:ff:fe00:2","TCP","644","49153  >  8080 [ACK] Seq=8577 Ack=1 Win=131072 Len=536 TSval=66388 TSecr=66387"
"10174","66.429253","fe80::200:ff:fe00:51","fe80::200:ff:fe00:2","TCP","644","49153  >  8080 [ACK] Seq=9113 Ack=1 Win=131072 Len=536 TSval=66388 TSecr=66387"
"10176","66.435482","fe80::200:ff:fe00:51","fe80::200:ff:fe00:2","TCP","644","49153  >  8080 [ACK] Seq=9649 Ack=1 Win=131072 Len=536 TSval=66402 TSecr=66401"
"10180","66.443693","fe80::200:ff:fe00:51","fe80::200:ff:fe00:2","TCP","644","49153  >  8080 [ACK] Seq=10185 Ack=1 Win=131072 Len=536 TSval=66402 TSecr=66401"
"10182","66.449842","fe80::200:ff:fe00:51","fe80::200:ff:fe00:2","TCP","644","49153  >  8080 [ACK] Seq=10721 Ack=1 Win=131072 Len=536 TSval=66402 TSecr=66401"
"10183","66.454040","fe80::200:ff:fe00:51","fe80::200:ff:fe00:2","TCP","644","[TCP Retransmission] 49153  >  8080 [ACK] Seq=10721 Ack=1 Win=131072 Len=536 TSval=66402 TSecr=66401"
"10187","66.460957","fe80::200:ff:fe00:51","fe80::200:ff:fe00:2","TCP","644","49153  >  8080 [ACK] Seq=11257 Ack=1 Win=131072 Len=536 TSval=66416 TSecr=66414"
"10189","66.467006","fe80::200:ff:fe00:51","fe80::200:ff:fe00:2","TCP","644","49153  >  8080 [ACK] Seq=11793 Ack=1 Win=131072 Len=536 TSval=66416 TSecr=66414"
"10191","66.473963","fe80::200:ff:fe00:51","fe80::200:ff:fe00:2","TCP","644","49153  >  8080 [ACK] Seq=12329 Ack=1 Win=131072 Len=536 TSval=66416 TSecr=66414"
"10193","66.479732","fe80::200:ff:fe00:51","fe80::200:ff:fe00:2","TCP","644","49153  >  8080 [ACK] Seq=12865 Ack=1 Win=131072 Len=536 TSval=66429 TSecr=66428"
"10195","66.485441","fe80::200:ff:fe00:51","fe80::200:ff:fe00:2","TCP","644","49153  >  8080 [ACK] Seq=13401 Ack=1 Win=131072 Len=536 TSval=66429 TSecr=66428"
"10197","66.491270","fe80::200:ff:fe00:51","fe80::200:ff:fe00:2","TCP","644","49153  >  8080 [ACK] Seq=13937 Ack=1 Win=131072 Len=536 TSval=66429 TSecr=66428"
"10199","66.498227","fe80::200:ff:fe00:51","fe80::200:ff:fe00:2","TCP","644","49153  >  8080 [ACK] Seq=14473 Ack=1 Win=131072 Len=536 TSval=66443 TSecr=66441"
"10201","66.504276","fe80::200:ff:fe00:51","fe80::200:ff:fe00:2","TCP","644","49153  >  8080 [ACK] Seq=15009 Ack=1 Win=131072 Len=536 TSval=66443 TSecr=66441"
"10203","66.510145","fe80::200:ff:fe00:51","fe80::200:ff:fe00:2","TCP","644","49153  >  8080 [ACK] Seq=15545 Ack=1 Win=131072 Len=536 TSval=66443 TSecr=66441"
"10205","66.516094","fe80::200:ff:fe00:51","fe80::200:ff:fe00:2","TCP","644","49153  >  8080 [ACK] Seq=16081 Ack=1 Win=131072 Len=536 TSval=66461 TSecr=66460"
"10207","66.519227","fe80::200:ff:fe00:51","fe80::200:ff:fe00:2","TCP","644","49153  >  8080 [ACK] Seq=16617 Ack=1 Win=131072 Len=536 TSval=66461 TSecr=66460"
"10211","66.523900","fe80::200:ff:fe00:51","fe80::200:ff:fe00:2","TCP","644","49153  >  8080 [ACK] Seq=17153 Ack=1 Win=131072 Len=536 TSval=66461 TSecr=66460"
"10217","66.530453","fe80::200:ff:fe00:51","fe80::200:ff:fe00:2","TCP","644","49153  >  8080 [ACK] Seq=17689 Ack=1 Win=131072 Len=536 TSval=66524 TSecr=66473"
"10224","66.538828","fe80::200:ff:fe00:51","fe80::200:ff:fe00:2","TCP","644","[TCP Retransmission] 49153  >  8080 [ACK] Seq=17689 Ack=1 Win=131072 Len=536 TSval=66524 TSecr=66473"
"10225","66.544326","fe80::200:ff:fe00:51","fe80::200:ff:fe00:2","TCP","644","[TCP Retransmission] 49153  >  8080 [ACK] Seq=17689 Ack=1 Win=131072 Len=536 TSval=66524 TSecr=66473"
"10227","66.550415","fe80::200:ff:fe00:51","fe80::200:ff:fe00:2","TCP","644","49153  >  8080 [ACK] Seq=18225 Ack=1 Win=131072 Len=536 TSval=66524 TSecr=66473"
"10231","66.558124","fe80::200:ff:fe00:51","fe80::200:ff:fe00:2","TCP","644","49153  >  8080 [ACK] Seq=18761 Ack=1 Win=131072 Len=536 TSval=66524 TSecr=66473"
"10233","66.564273","fe80::200:ff:fe00:51","fe80::200:ff:fe00:2","TCP","644","49153  >  8080 [ACK] Seq=19297 Ack=1 Win=131072 Len=536 TSval=66529 TSecr=66486"
"10237","66.571962","fe80::200:ff:fe00:51","fe80::200:ff:fe00:2","TCP","644","49153  >  8080 [ACK] Seq=19833 Ack=1 Win=131072 Len=536 TSval=66529 TSecr=66486"
"10239","66.578251","fe80::200:ff:fe00:51","fe80::200:ff:fe00:2","TCP","644","49153  >  8080 [ACK] Seq=20369 Ack=1 Win=131072 Len=536 TSval=66529 TSecr=66486"
"10243","66.585400","fe80::200:ff:fe00:51","fe80::200:ff:fe00:2","TCP","644","49153  >  8080 [ACK] Seq=20905 Ack=1 Win=131072 Len=536 TSval=66531 TSecr=66497"
"10245","66.591709","fe80::200:ff:fe00:51","fe80::200:ff:fe00:2","TCP","644","49153  >  8080 [ACK] Seq=21441 Ack=1 Win=131072 Len=536 TSval=66531 TSecr=66497"
"10249","66.598958","fe80::200:ff:fe00:51","fe80::200:ff:fe00:2","TCP","644","49153  >  8080 [ACK] Seq=21977 Ack=1 Win=131072 Len=536 TSval=66531 TSecr=66497"
"10251","66.605127","fe80::200:ff:fe00:51","fe80::200:ff:fe00:2","TCP","644","49153  >  8080 [ACK] Seq=22513 Ack=1 Win=131072 Len=536 TSval=66535 TSecr=66510"
"10255","66.611924","fe80::200:ff:fe00:51","fe80::200:ff:fe00:2","TCP","644","49153  >  8080 [ACK] Seq=23049 Ack=1 Win=131072 Len=536 TSval=66535 TSecr=66510"
"10256","66.615642","fe80::200:ff:fe00:51","fe80::200:ff:fe00:2","TCP","644","[TCP Retransmission] 49153  >  8080 [ACK] Seq=23049 Ack=1 Win=131072 Len=536 TSval=66535 TSecr=66510"
"10258","66.621711","fe80::200:ff:fe00:51","fe80::200:ff:fe00:2","TCP","644","49153  >  8080 [ACK] Seq=23585 Ack=1 Win=131072 Len=536 TSval=66535 TSecr=66510"
"10262","66.628968","fe80::200:ff:fe00:51","fe80::200:ff:fe00:2","TCP","644","49153  >  8080 [ACK] Seq=24121 Ack=1 Win=131072 Len=536 TSval=66537 TSecr=66519"
"10264","66.634937","fe80::200:ff:fe00:51","fe80::200:ff:fe00:2","TCP","644","49153  >  8080 [ACK] Seq=24657 Ack=1 Win=131072 Len=536 TSval=66537 TSecr=66519"
"10268","66.641694","fe80::200:ff:fe00:51","fe80::200:ff:fe00:2","TCP","644","49153  >  8080 [ACK] Seq=25193 Ack=1 Win=131072 Len=536 TSval=66537 TSecr=66519"
"10270","66.647783","fe80::200:ff:fe00:51","fe80::200:ff:fe00:2","TCP","644","49153  >  8080 [ACK] Seq=25729 Ack=1 Win=131072 Len=536 TSval=66539 TSecr=66527"
"10274","66.655694","fe80::200:ff:fe00:51","fe80::200:ff:fe00:2","TCP","644","49153  >  8080 [ACK] Seq=26265 Ack=1 Win=131072 Len=536 TSval=66539 TSecr=66527"
"10276","66.661463","fe80::200:ff:fe00:51","fe80::200:ff:fe00:2","TCP","644","49153  >  8080 [ACK] Seq=26801 Ack=1 Win=131072 Len=536 TSval=66539 TSecr=66527"
"10280","66.668779","fe80::200:ff:fe00:51","fe80::200:ff:fe00:2","TCP","644","49153  >  8080 [ACK] Seq=27337 Ack=1 Win=131072 Len=536 TSval=66558 TSecr=66556"
"10282","66.674948","fe80::200:ff:fe00:51","fe80::200:ff:fe00:2","TCP","644","49153  >  8080 [ACK] Seq=27873 Ack=1 Win=131072 Len=536 TSval=66558 TSecr=66556"
"10286","66.681965","fe80::200:ff:fe00:51","fe80::200:ff:fe00:2","TCP","644","49153  >  8080 [ACK] Seq=28409 Ack=1 Win=131072 Len=536 TSval=66558 TSecr=66556"
"10288","66.685498","fe80::200:ff:fe00:51","fe80::200:ff:fe00:2","TCP","644","49153  >  8080 [ACK] Seq=28945 Ack=1 Win=131072 Len=536 TSval=66572 TSecr=66570"
"10292","66.690239","fe80::200:ff:fe00:51","fe80::200:ff:fe00:2","TCP","644","49153  >  8080 [ACK] Seq=29481 Ack=1 Win=131072 Len=536 TSval=66572 TSecr=66570"
"10294","66.693412","fe80::200:ff:fe00:51","fe80::200:ff:fe00:2","TCP","644","49153  >  8080 [ACK] Seq=30017 Ack=1 Win=131072 Len=536 TSval=66572 TSecr=66570"
"10295","66.696590","fe80::200:ff:fe00:51","fe80::200:ff:fe00:2","TCP","644","[TCP Retransmission] 49153  >  8080 [ACK] Seq=30017 Ack=1 Win=131072 Len=536 TSval=66572 TSecr=66570"
"10296","66.699768","fe80::200:ff:fe00:51","fe80::200:ff:fe00:2","TCP","644","[TCP Retransmission] 49153  >  8080 [ACK] Seq=30017 Ack=1 Win=131072 Len=536 TSval=66572 TSecr=66570"
"10300","66.706725","fe80::200:ff:fe00:51","fe80::200:ff:fe00:2","TCP","644","49153  >  8080 [ACK] Seq=30553 Ack=1 Win=131072 Len=536 TSval=66586 TSecr=66584"
"10302","66.712454","fe80::200:ff:fe00:51","fe80::200:ff:fe00:2","TCP","644","49153  >  8080 [ACK] Seq=31089 Ack=1 Win=131072 Len=536 TSval=66586 TSecr=66584"
"10306","66.719731","fe80::200:ff:fe00:51","fe80::200:ff:fe00:2","TCP","644","49153  >  8080 [ACK] Seq=31625 Ack=1 Win=131072 Len=536 TSval=66586 TSecr=66584"
"10308","66.725740","fe80::200:ff:fe00:51","fe80::200:ff:fe00:2","TCP","644","49153  >  8080 [ACK] Seq=32161 Ack=1 Win=131072 Len=536 TSval=66599 TSecr=66598"
"10312","66.732717","fe80::200:ff:fe00:51","fe80::200:ff:fe00:2","TCP","644","49153  >  8080 [ACK] Seq=32697 Ack=1 Win=131072 Len=536 TSval=66599 TSecr=66598"
"10314","66.738846","fe80::200:ff:fe00:51","fe80::200:ff:fe00:2","TCP","644","49153  >  8080 [ACK] Seq=33233 Ack=1 Win=131072 Len=536 TSval=66599 TSecr=66598"
"10318","66.745923","fe80::200:ff:fe00:51","fe80::200:ff:fe00:2","TCP","644","49153  >  8080 [ACK] Seq=33769 Ack=1 Win=131072 Len=536 TSval=66612 TSecr=66611"
"10320","66.751692","fe80::200:ff:fe00:51","fe80::200:ff:fe00:2","TCP","644","49153  >  8080 [ACK] Seq=34305 Ack=1 Win=131072 Len=536 TSval=66612 TSecr=66611"
"10324","66.758729","fe80::200:ff:fe00:51","fe80::200:ff:fe00:2","TCP","644","49153  >  8080 [ACK] Seq=34841 Ack=1 Win=131072 Len=536 TSval=66612 TSecr=66611"
"10326","66.765038","fe80::200:ff:fe00:51","fe80::200:ff:fe00:2","TCP","644","49153  >  8080 [ACK] Seq=35377 Ack=1 Win=131072 Len=536 TSval=66629 TSecr=66628"
"10327","66.769396","fe80::200:ff:fe00:51","fe80::200:ff:fe00:2","TCP","644","[TCP Retransmission] 49153  >  8080 [ACK] Seq=35377 Ack=1 Win=131072 Len=536 TSval=66629 TSecr=66628"
"10331","66.776433","fe80::200:ff:fe00:51","fe80::200:ff:fe00:2","TCP","644","49153  >  8080 [ACK] Seq=35913 Ack=1 Win=131072 Len=536 TSval=66629 TSecr=66628"
"10333","66.782522","fe80::200:ff:fe00:51","fe80::200:ff:fe00:2","TCP","644","49153  >  8080 [ACK] Seq=36449 Ack=1 Win=131072 Len=536 TSval=66629 TSecr=66628"
"10335","66.789525","fe80::200:ff:fe00:51","fe80::200:ff:fe00:2","TCP","644","49153  >  8080 [ACK] Seq=36985 Ack=1 Win=131072 Len=536 TSval=66642 TSecr=66641"
"10339","66.796702","fe80::200:ff:fe00:51","fe80::200:ff:fe00:2","TCP","644","49153  >  8080 [ACK] Seq=37521 Ack=1 Win=131072 Len=536 TSval=66642 TSecr=66641"
"10343","66.803639","fe80::200:ff:fe00:51","fe80::200:ff:fe00:2","TCP","644","49153  >  8080 [ACK] Seq=38057 Ack=1 Win=131072 Len=536 TSval=66642 TSecr=66641"
"10345","66.809547","fe80::200:ff:fe00:51","fe80::200:ff:fe00:2","TCP","644","49153  >  8080 [ACK] Seq=38593 Ack=1 Win=131072 Len=536 TSval=66656 TSecr=66654"
"10349","66.816504","fe80::200:ff:fe00:51","fe80::200:ff:fe00:2","TCP","644","49153  >  8080 [ACK] Seq=39129 Ack=1 Win=131072 Len=536 TSval=66656 TSecr=66654"
"10351","66.822673","fe80::200:ff:fe00:51","fe80::200:ff:fe00:2","TCP","644","49153  >  8080 [ACK] Seq=39665 Ack=1 Win=131072 Len=536 TSval=66656 TSecr=66654"
"10355","66.829650","fe80::200:ff:fe00:51","fe80::200:ff:fe00:2","TCP","644","49153  >  8080 [ACK] Seq=40201 Ack=1 Win=131072 Len=536 TSval=66668 TSecr=66667"
"10357","66.835859","fe80::200:ff:fe00:51","fe80::200:ff:fe00:2","TCP","644","49153  >  8080 [ACK] Seq=40737 Ack=1 Win=131072 Len=536 TSval=66668 TSecr=66667"
"10361","66.840340","fe80::200:ff:fe00:51","fe80::200:ff:fe00:2","TCP","644","49153  >  8080 [ACK] Seq=41273 Ack=1 Win=131072 Len=536 TSval=66668 TSecr=66667"
"10363","66.843793","fe80::200:ff:fe00:51","fe80::200:ff:fe00:2","TCP","644","49153  >  8080 [ACK] Seq=41809 Ack=1 Win=131072 Len=536 TSval=66682 TSecr=66681"
"10364","66.847331","fe80::200:ff:fe00:51","fe80::200:ff:fe00:2","TCP","644","[TCP Retransmission] 49153  >  8080 [ACK] Seq=41809 Ack=1 Win=131072 Len=536 TSval=66682 TSecr=66681"
"10368","66.853006","fe80::200:ff:fe00:51","fe80::200:ff:fe00:2","TCP","644","49153  >  8080 [ACK] Seq=42345 Ack=1 Win=131072 Len=536 TSval=66682 TSecr=66681"
"10370","66.856359","fe80::200:ff:fe00:51","fe80::200:ff:fe00:2","TCP","644","49153  >  8080 [ACK] Seq=42881 Ack=1 Win=131072 Len=536 TSval=66682 TSecr=66681"
"10374","66.860640","fe80::200:ff:fe00:51","fe80::200:ff:fe00:2","TCP","644","49153  >  8080 [ACK] Seq=43417 Ack=1 Win=131072 Len=536 TSval=66690 TSecr=66689"
"10376","66.864373","fe80::200:ff:fe00:51","fe80::200:ff:fe00:2","TCP","644","49153  >  8080 [ACK] Seq=43953 Ack=1 Win=131072 Len=536 TSval=66690 TSecr=66689"
"10377","66.868791","fe80::200:ff:fe00:51","fe80::200:ff:fe00:2","TCP","644","[TCP Retransmission] 49153  >  8080 [ACK] Seq=43953 Ack=1 Win=131072 Len=536 TSval=66690 TSecr=66689"
"10378","66.873489","fe80::200:ff:fe00:51","fe80::200:ff:fe00:2","TCP","644","[TCP Retransmission] 49153  >  8080 [ACK] Seq=43953 Ack=1 Win=131072 Len=536 TSval=66690 TSecr=66689"
"10382","66.880766","fe80::200:ff:fe00:51","fe80::200:ff:fe00:2","TCP","644","49153  >  8080 [ACK] Seq=44489 Ack=1 Win=131072 Len=536 TSval=66690 TSecr=66689"
"10384","66.887035","fe80::200:ff:fe00:51","fe80::200:ff:fe00:2","TCP","644","49153  >  8080 [ACK] Seq=45025 Ack=1 Win=131072 Len=536 TSval=66707 TSecr=66706"
"10386","66.892744","fe80::200:ff:fe00:51","fe80::200:ff:fe00:2","TCP","644","49153  >  8080 [ACK] Seq=45561 Ack=1 Win=131072 Len=536 TSval=66707 TSecr=66706"
"10389","66.899787","fe80::200:ff:fe00:51","fe80::200:ff:fe00:2","TCP","644","[TCP Retransmission] 49153  >  8080 [ACK] Seq=45561 Ack=1 Win=131072 Len=536 TSval=66707 TSecr=66706"
"10391","66.905876","fe80::200:ff:fe00:51","fe80::200:ff:fe00:2","TCP","644","49153  >  8080 [ACK] Seq=46097 Ack=1 Win=131072 Len=536 TSval=66707 TSecr=66706"
"10393","66.913013","fe80::200:ff:fe00:51","fe80::200:ff:fe00:2","TCP","644","49153  >  8080 [ACK] Seq=46633 Ack=1 Win=131072 Len=536 TSval=66719 TSecr=66718"
"10395","66.919142","fe80::200:ff:fe00:51","fe80::200:ff:fe00:2","TCP","644","49153  >  8080 [ACK] Seq=47169 Ack=1 Win=131072 Len=536 TSval=66719 TSecr=66718"
"10397","66.924951","fe80::200:ff:fe00:51","fe80::200:ff:fe00:2","TCP","644","49153  >  8080 [ACK] Seq=47705 Ack=1 Win=131072 Len=536 TSval=66719 TSecr=66718"
"10399","66.930760","fe80::200:ff:fe00:51","fe80::200:ff:fe00:2","TCP","644","49153  >  8080 [ACK] Seq=48241 Ack=1 Win=131072 Len=536 TSval=66733 TSecr=66732"
"10403","66.937716","fe80::200:ff:fe00:51","fe80::200:ff:fe00:2","TCP","644","49153  >  8080 [ACK] Seq=48777 Ack=1 Win=131072 Len=536 TSval=66733 TSecr=66732"
"10407","66.944613","fe80::200:ff:fe00:51","fe80::200:ff:fe00:2","TCP","644","49153  >  8080 [ACK] Seq=49313 Ack=1 Win=131072 Len=536 TSval=66733 TSecr=66732"
"10409","66.950362","fe80::200:ff:fe00:51","fe80::200:ff:fe00:2","TCP","644","49153  >  8080 [ACK] Seq=49849 Ack=1 Win=131072 Len=536 TSval=66746 TSecr=66745"
"10411","66.956271","fe80::200:ff:fe00:51","fe80::200:ff:fe00:2","TCP","644","49153  >  8080 [ACK] Seq=50385 Ack=1 Win=131072 Len=536 TSval=66746 TSecr=66745"
"10417","66.965531","fe80::200:ff:fe00:51","fe80::200:ff:fe00:2","TCP","644","49153  >  8080 [ACK] Seq=50921 Ack=1 Win=131072 Len=536 TSval=66746 TSecr=66745"
"10420","66.970258","fe80::200:ff:fe00:51","fe80::200:ff:fe00:2","TCP","644","[TCP Retransmission] 49153  >  8080 [ACK] Seq=50921 Ack=1 Win=131072 Len=536 TSval=66746 TSecr=66745"
"10422","66.976347","fe80::200:ff:fe00:51","fe80::200:ff:fe00:2","TCP","644","49153  >  8080 [ACK] Seq=51457 Ack=1 Win=131072 Len=536 TSval=66759 TSecr=66758"
"10426","66.983344","fe80::200:ff:fe00:51","fe80::200:ff:fe00:2","TCP","644","49153  >  8080 [ACK] Seq=51993 Ack=1 Win=131072 Len=536 TSval=66759 TSecr=66758"
"10428","66.989253","fe80::200:ff:fe00:51","fe80::200:ff:fe00:2","TCP","644","49153  >  8080 [ACK] Seq=52529 Ack=1 Win=131072 Len=536 TSval=66759 TSecr=66758"
"10432","66.996030","fe80::200:ff:fe00:51","fe80::200:ff:fe00:2","TCP","644","49153  >  8080 [ACK] Seq=53065 Ack=1 Win=131072 Len=536 TSval=66776 TSecr=66775"
"10441","67.014805","fe80::200:ff:fe00:51","fe80::200:ff:fe00:2","TCP","644","49153  >  8080 [ACK] Seq=53601 Ack=1 Win=131072 Len=536 TSval=66776 TSecr=66775"
"10451","67.036442","fe80::200:ff:fe00:51","fe80::200:ff:fe00:2","TCP","644","[TCP Retransmission] 49153  >  8080 [ACK] Seq=53601 Ack=1 Win=131072 Len=536 TSval=66776 TSecr=66775"
"10517","67.168680","fe80::200:ff:fe00:51","fe80::200:ff:fe00:2","TCP","644","[TCP Retransmission] 49153  >  8080 [ACK] Seq=53601 Ack=1 Win=131072 Len=536 TSval=66776 TSecr=66775"
"10581","67.282513","fe80::200:ff:fe00:51","fe80::200:ff:fe00:2","TCP","644","[TCP Retransmission] 49153  >  8080 [ACK] Seq=53601 Ack=1 Win=131072 Len=536 TSval=66776 TSecr=66775"
"10610","67.331971","fe80::200:ff:fe00:51","fe80::200:ff:fe00:2","TCP","644","[TCP Retransmission] 49153  >  8080 [ACK] Seq=53601 Ack=1 Win=131072 Len=536 TSval=66776 TSecr=66775"
"10612","67.338060","fe80::200:ff:fe00:51","fe80::200:ff:fe00:2","TCP","644","[TCP Previous segment not captured] 49153  >  8080 [ACK] Seq=61105 Ack=1 Win=131072 Len=536 TSval=66840 TSecr=66839"
"10616","67.344857","fe80::200:ff:fe00:51","fe80::200:ff:fe00:2","TCP","644","[TCP Previous segment not captured] 49153  >  8080 [ACK] Seq=62713 Ack=1 Win=131072 Len=536 TSval=66853 TSecr=66851"
"10618","67.350585","fe80::200:ff:fe00:51","fe80::200:ff:fe00:2","TCP","644","49153  >  8080 [ACK] Seq=63249 Ack=1 Win=131072 Len=536 TSval=66853 TSecr=66851"
"10620","67.356554","fe80::200:ff:fe00:51","fe80::200:ff:fe00:2","TCP","644","[TCP Previous segment not captured] 49153  >  8080 [ACK] Seq=64321 Ack=1 Win=131072 Len=536 TSval=66861 TSecr=66860"
"10624","67.363551","fe80::200:ff:fe00:51","fe80::200:ff:fe00:2","TCP","644","[TCP Previous segment not captured] 49153  >  8080 [ACK] Seq=65929 Ack=1 Win=131072 Len=536 TSval=66880 TSecr=66879"
"10628","67.370408","fe80::200:ff:fe00:51","fe80::200:ff:fe00:2","TCP","644","49153  >  8080 [ACK] Seq=66465 Ack=1 Win=131072 Len=536 TSval=66880 TSecr=66879"
"10630","67.376217","fe80::200:ff:fe00:51","fe80::200:ff:fe00:2","TCP","644","49153  >  8080 [ACK] Seq=67001 Ack=1 Win=131072 Len=536 TSval=66880 TSecr=66879"
"10634","67.383334","fe80::200:ff:fe00:51","fe80::200:ff:fe00:2","TCP","644","49153  >  8080 [ACK] Seq=67537 Ack=1 Win=131072 Len=536 TSval=66899 TSecr=66893"
"10635","67.389108","fe80::200:ff:fe00:51","fe80::200:ff:fe00:2","TCP","644","[TCP Retransmission] 49153  >  8080 [ACK] Seq=67537 Ack=1 Win=131072 Len=536 TSval=66899 TSecr=66893"
"10637","67.395377","fe80::200:ff:fe00:51","fe80::200:ff:fe00:2","TCP","644","49153  >  8080 [ACK] Seq=68073 Ack=1 Win=131072 Len=536 TSval=66899 TSecr=66893"
"10641","67.402274","fe80::200:ff:fe00:51","fe80::200:ff:fe00:2","TCP","644","[TCP Previous segment not captured] 49153  >  8080 [ACK] Seq=69145 Ack=1 Win=131072 Len=536 TSval=66938 TSecr=66912"
"10643","67.408123","fe80::200:ff:fe00:51","fe80::200:ff:fe00:2","TCP","644","49153  >  8080 [ACK] Seq=69681 Ack=1 Win=131072 Len=536 TSval=66938 TSecr=66912"
"10645","67.414032","fe80::200:ff:fe00:51","fe80::200:ff:fe00:2","TCP","644","49153  >  8080 [ACK] Seq=70217 Ack=1 Win=131072 Len=536 TSval=66938 TSecr=66912"
"10649","67.420989","fe80::200:ff:fe00:51","fe80::200:ff:fe00:2","TCP","644","49153  >  8080 [ACK] Seq=70753 Ack=1 Win=131072 Len=536 TSval=66945 TSecr=66925"
"10653","67.428066","fe80::200:ff:fe00:51","fe80::200:ff:fe00:2","TCP","644","49153  >  8080 [ACK] Seq=71289 Ack=1 Win=131072 Len=536 TSval=66945 TSecr=66925"
"10655","67.431399","fe80::200:ff:fe00:51","fe80::200:ff:fe00:2","TCP","644","49153  >  8080 [ACK] Seq=71825 Ack=1 Win=131072 Len=536 TSval=66945 TSecr=66925"
"10658","67.437474","fe80::200:ff:fe00:51","fe80::200:ff:fe00:2","TCP","644","[TCP Retransmission] 49153  >  8080 [ACK] Seq=71825 Ack=1 Win=131072 Len=536 TSval=66945 TSecr=66925"
"10669","67.447970","fe80::200:ff:fe00:51","fe80::200:ff:fe00:2","TCP","644","[TCP Retransmission] 49153  >  8080 [ACK] Seq=71825 Ack=1 Win=131072 Len=536 TSval=66945 TSecr=66925"
"10672","67.455793","fe80::200:ff:fe00:51","fe80::200:ff:fe00:2","TCP","644","[TCP Retransmission] 49153  >  8080 [ACK] Seq=71825 Ack=1 Win=131072 Len=536 TSval=66945 TSecr=66925"
"10676","67.462690","fe80::200:ff:fe00:51","fe80::200:ff:fe00:2","TCP","644","49153  >  8080 [ACK] Seq=72361 Ack=1 Win=131072 Len=536 TSval=66965 TSecr=66937"
"10680","67.469807","fe80::200:ff:fe00:51","fe80::200:ff:fe00:2","TCP","644","[TCP Previous segment not captured] 49153  >  8080 [ACK] Seq=77185 Ack=1 Win=131072 Len=536 TSval=66983 TSecr=66982"
"10684","67.476764","fe80::200:ff:fe00:51","fe80::200:ff:fe00:2","TCP","644","49153  >  8080 [ACK] Seq=77721 Ack=1 Win=131072 Len=536 TSval=66983 TSecr=66982"
"10686","67.484021","fe80::200:ff:fe00:51","fe80::200:ff:fe00:2","TCP","644","[TCP Previous segment not captured] 49153  >  8080 [ACK] Seq=78793 Ack=1 Win=131072 Len=536 TSval=66996 TSecr=66995"
"10688","67.490110","fe80::200:ff:fe00:51","fe80::200:ff:fe00:2","TCP","644","49153  >  8080 [ACK] Seq=79329 Ack=1 Win=131072 Len=536 TSval=66996 TSecr=66995"
"10689","67.496324","fe80::200:ff:fe00:51","fe80::200:ff:fe00:2","TCP","644","[TCP Retransmission] 49153  >  8080 [ACK] Seq=79329 Ack=1 Win=131072 Len=536 TSval=66996 TSecr=66995"
"10705","67.519579","fe80::200:ff:fe00:51","fe80::200:ff:fe00:2","TCP","644","[TCP Previous segment not captured] 49153  >  8080 [ACK] Seq=80401 Ack=1 Win=131072 Len=536 TSval=67327 TSecr=67202"
"10709","67.527168","fe80::200:ff:fe00:51","fe80::200:ff:fe00:2","TCP","644","49153  >  8080 [ACK] Seq=80937 Ack=1 Win=131072 Len=536 TSval=67327 TSecr=67202"
"10713","67.534357","fe80::200:ff:fe00:51","fe80::200:ff:fe00:2","TCP","644","49153  >  8080 [ACK] Seq=81473 Ack=1 Win=131072 Len=536 TSval=67345 TSecr=67344"
"10717","67.542086","fe80::200:ff:fe00:51","fe80::200:ff:fe00:2","TCP","644","49153  >  8080 [ACK] Seq=82009 Ack=1 Win=131072 Len=536 TSval=67345 TSecr=67344"
"10721","67.549275","fe80::200:ff:fe00:51","fe80::200:ff:fe00:2","TCP","644","49153  >  8080 [ACK] Seq=82545 Ack=1 Win=131072 Len=536 TSval=67364 TSecr=67351"
"10723","67.555024","fe80::200:ff:fe00:51","fe80::200:ff:fe00:2","TCP","644","49153  >  8080 [ACK] Seq=83081 Ack=1 Win=131072 Len=536 TSval=67371 TSecr=67357"
"10726","67.563279","fe80::200:ff:fe00:51","fe80::200:ff:fe00:2","TCP","644","[TCP Retransmission] 49153  >  8080 [ACK] Seq=83081 Ack=1 Win=131072 Len=536 TSval=67371 TSecr=67357"
"10730","67.570768","fe80::200:ff:fe00:51","fe80::200:ff:fe00:2","TCP","644","[TCP Fast Retransmission] 49153  >  8080 [ACK] Seq=54137 Ack=1 Win=131072 Len=536 TSval=67383 TSecr=67363"
"10734","67.578077","fe80::200:ff:fe00:51","fe80::200:ff:fe00:2","TCP","644","[TCP Retransmission] 49153  >  8080 [ACK] Seq=54673 Ack=1 Win=131072 Len=536 TSval=67578 TSecr=67577"
"10735","67.581515","fe80::200:ff:fe00:51","fe80::200:ff:fe00:2","TCP","644","[TCP Retransmission] 49153  >  8080 [ACK] Seq=54673 Ack=1 Win=131072 Len=536 TSval=67578 TSecr=67577"
"10739","67.588943","fe80::200:ff:fe00:51","fe80::200:ff:fe00:2","TCP","644","[TCP Retransmission] 49153  >  8080 [ACK] Seq=55209 Ack=1 Win=131072 Len=536 TSval=67589 TSecr=67587"
"10743","67.596332","fe80::200:ff:fe00:51","fe80::200:ff:fe00:2","TCP","644","[TCP Retransmission] 49153  >  8080 [ACK] Seq=55745 Ack=1 Win=131072 Len=536 TSval=67597 TSecr=67595"
"10747","67.604001","fe80::200:ff:fe00:51","fe80::200:ff:fe00:2","TCP","644","[TCP Retransmission] 49153  >  8080 [ACK] Seq=56281 Ack=1 Win=131072 Len=536 TSval=67604 TSecr=67602"
"10751","67.611218","fe80::200:ff:fe00:51","fe80::200:ff:fe00:2","TCP","644","[TCP Retransmission] 49153  >  8080 [ACK] Seq=56817 Ack=1 Win=131072 Len=536 TSval=67611 TSecr=67610"
"10755","67.617955","fe80::200:ff:fe00:51","fe80::200:ff:fe00:2","TCP","644","49153  >  8080 [ACK] Seq=83617 Ack=1 Win=131072 Len=536 TSval=67611 TSecr=67610"
"10759","67.625192","fe80::200:ff:fe00:51","fe80::200:ff:fe00:2","TCP","644","[TCP Retransmission] 49153  >  8080 [ACK] Seq=57353 Ack=1 Win=131072 Len=536 TSval=67618 TSecr=67617"
"10763","67.632389","fe80::200:ff:fe00:51","fe80::200:ff:fe00:2","TCP","644","49153  >  8080 [ACK] Seq=84153 Ack=1 Win=131072 Len=536 TSval=67618 TSecr=67617"
"10767","67.639606","fe80::200:ff:fe00:51","fe80::200:ff:fe00:2","TCP","644","49153  >  8080 [ACK] Seq=84689 Ack=1 Win=131072 Len=536 TSval=67625 TSecr=67624"
"10771","67.646563","fe80::200:ff:fe00:51","fe80::200:ff:fe00:2","TCP","644","[TCP Fast Retransmission] 49153  >  8080 [ACK] Seq=57889 Ack=1 Win=131072 Len=536 TSval=67632 TSecr=67631"
"10773","67.653300","fe80::200:ff:fe00:51","fe80::200:ff:fe00:2","TCP","644","49153  >  8080 [ACK] Seq=85225 Ack=1 Win=131072 Len=536 TSval=67632 TSecr=67631"
"10776","67.658161","fe80::200:ff:fe00:51","fe80::200:ff:fe00:2","TCP","644","[TCP Retransmission] 49153  >  8080 [ACK] Seq=85225 Ack=1 Win=131072 Len=536 TSval=67632 TSecr=67631"
"10778","67.664030","fe80::200:ff:fe00:51","fe80::200:ff:fe00:2","TCP","644","49153  >  8080 [ACK] Seq=85761 Ack=1 Win=131072 Len=536 TSval=67639 TSecr=67638"
"10781","67.671493","fe80::200:ff:fe00:51","fe80::200:ff:fe00:2","TCP","644","[TCP Retransmission] 49153  >  8080 [ACK] Seq=85761 Ack=1 Win=131072 Len=536 TSval=67639 TSecr=67638"
"10785","67.678570","fe80::200:ff:fe00:51","fe80::200:ff:fe00:2","TCP","644","49153  >  8080 [ACK] Seq=86297 Ack=1 Win=131072 Len=536 TSval=67647 TSecr=67646"
"10789","67.685767","fe80::200:ff:fe00:51","fe80::200:ff:fe00:2","TCP","644","[TCP Fast Retransmission] 49153  >  8080 [ACK] Seq=58425 Ack=1 Win=131072 Len=536 TSval=67658 TSecr=67653"
"10793","67.692524","fe80::200:ff:fe00:51","fe80::200:ff:fe00:2","TCP","644","49153  >  8080 [ACK] Seq=86833 Ack=1 Win=131072 Len=536 TSval=67658 TSecr=67653"
"10795","67.698253","fe80::200:ff:fe00:51","fe80::200:ff:fe00:2","TCP","644","49153  >  8080 [ACK] Seq=87369 Ack=1 Win=131072 Len=536 TSval=67671 TSecr=67664"
"10797","67.703981","fe80::200:ff:fe00:51","fe80::200:ff:fe00:2","TCP","644","49153  >  8080 [ACK] Seq=87905 Ack=1 Win=131072 Len=536 TSval=67678 TSecr=67677"
"10802","67.712853","fe80::200:ff:fe00:51","fe80::200:ff:fe00:2","TCP","644","[TCP Retransmission] 49153  >  8080 [ACK] Seq=87905 Ack=1 Win=131072 Len=536 TSval=67678 TSecr=67677"
"10806","67.719930","fe80::200:ff:fe00:51","fe80::200:ff:fe00:2","TCP","644","49153  >  8080 [ACK] Seq=88441 Ack=1 Win=131072 Len=536 TSval=67686 TSecr=67685"
"10810","67.726847","fe80::200:ff:fe00:51","fe80::200:ff:fe00:2","TCP","644","[TCP Fast Retransmission] 49153  >  8080 [ACK] Seq=58961 Ack=1 Win=131072 Len=536 TSval=67693 TSecr=67692"
"10814","67.733984","fe80::200:ff:fe00:51","fe80::200:ff:fe00:2","TCP","644","49153  >  8080 [ACK] Seq=88977 Ack=1 Win=131072 Len=536 TSval=67693 TSecr=67692"
"10816","67.740901","fe80::200:ff:fe00:51","fe80::200:ff:fe00:2","TCP","644","49153  >  8080 [ACK] Seq=89513 Ack=1 Win=131072 Len=536 TSval=67711 TSecr=67698"
"10818","67.747190","fe80::200:ff:fe00:51","fe80::200:ff:fe00:2","TCP","644","49153  >  8080 [ACK] Seq=90049 Ack=1 Win=131072 Len=536 TSval=67713 TSecr=67704"
"10822","67.754467","fe80::200:ff:fe00:51","fe80::200:ff:fe00:2","TCP","644","49153  >  8080 [ACK] Seq=90585 Ack=1 Win=131072 Len=536 TSval=67720 TSecr=67719"
"10826","67.761524","fe80::200:ff:fe00:51","fe80::200:ff:fe00:2","TCP","644","49153  >  8080 [ACK] Seq=91121 Ack=1 Win=131072 Len=536 TSval=67727 TSecr=67726"
"10830","67.765885","fe80::200:ff:fe00:51","fe80::200:ff:fe00:2","TCP","644","[TCP Fast Retransmission] 49153  >  8080 [ACK] Seq=59497 Ack=1 Win=131072 Len=536 TSval=67734 TSecr=67733"
"10834","67.770326","fe80::200:ff:fe00:51","fe80::200:ff:fe00:2","TCP","644","49153  >  8080 [ACK] Seq=91657 Ack=1 Win=131072 Len=536 TSval=67734 TSecr=67733"
"10838","67.774727","fe80::200:ff:fe00:51","fe80::200:ff:fe00:2","TCP","644","49153  >  8080 [ACK] Seq=92193 Ack=1 Win=131072 Len=536 TSval=67754 TSecr=67740"
"10842","67.779288","fe80::200:ff:fe00:51","fe80::200:ff:fe00:2","TCP","644","49153  >  8080 [ACK] Seq=92729 Ack=1 Win=131072 Len=536 TSval=67762 TSecr=67747"
"10844","67.782461","fe80::200:ff:fe00:51","fe80::200:ff:fe00:2","TCP","644","49153  >  8080 [ACK] Seq=93265 Ack=1 Win=131072 Len=536 TSval=67766 TSecr=67753"
"10848","67.787122","fe80::200:ff:fe00:51","fe80::200:ff:fe00:2","TCP","644","49153  >  8080 [ACK] Seq=93801 Ack=1 Win=131072 Len=536 TSval=67771 TSecr=67760"
"10854","67.792511","fe80::200:ff:fe00:51","fe80::200:ff:fe00:2","TCP","644","49153  >  8080 [ACK] Seq=94337 Ack=1 Win=131072 Len=536 TSval=67775 TSecr=67765"
"10855","67.795669","fe80::200:ff:fe00:51","fe80::200:ff:fe00:2","TCP","644","[TCP Retransmission] 49153  >  8080 [ACK] Seq=94337 Ack=1 Win=131072 Len=536 TSval=67775 TSecr=67765"
"10880","67.837424","fe80::200:ff:fe00:51","fe80::200:ff:fe00:2","TCP","644","[TCP Retransmission] 49153  >  8080 [ACK] Seq=60033 Ack=1 Win=131072 Len=536 TSval=67779 TSecr=67769"
"10882","67.844037","fe80::200:ff:fe00:51","fe80::200:ff:fe00:2","TCP","644","[TCP Retransmission] 49153  >  8080 [ACK] Seq=60033 Ack=1 Win=131072 Len=536 TSval=67779 TSecr=67769"
"10899","67.873385","fe80::200:ff:fe00:51","fe80::200:ff:fe00:2","TCP","644","[TCP Retransmission] 49153  >  8080 [ACK] Seq=60033 Ack=1 Win=131072 Len=536 TSval=67779 TSecr=67769"
"11047","68.140997","fe80::200:ff:fe00:51","fe80::200:ff:fe00:2","TCP","644","[TCP Retransmission] 49153  >  8080 [ACK] Seq=60033 Ack=1 Win=131072 Len=536 TSval=67779 TSecr=67769"
"11157","68.339520","fe80::200:ff:fe00:51","fe80::200:ff:fe00:2","TCP","644","[TCP Retransmission] 49153  >  8080 [ACK] Seq=60033 Ack=1 Win=131072 Len=536 TSval=67779 TSecr=67769"
"11727","69.272116","fe80::200:ff:fe00:51","fe80::200:ff:fe00:2","TCP","644","[TCP Retransmission] 49153  >  8080 [ACK] Seq=60033 Ack=1 Win=131072 Len=536 TSval=67779 TSecr=67769"
"11810","69.369050","fe80::200:ff:fe00:51","fe80::200:ff:fe00:2","TCP","644","[TCP Retransmission] 49153  >  8080 [ACK] Seq=60569 Ack=1 Win=131072 Len=536 TSval=69369 TSecr=69278"
"11812","69.375099","fe80::200:ff:fe00:51","fe80::200:ff:fe00:2","TCP","644","[TCP Retransmission] 49153  >  8080 [ACK] Seq=61105 Ack=1 Win=131072 Len=536 TSval=69369 TSecr=69278"
"11817","69.384248","fe80::200:ff:fe00:51","fe80::200:ff:fe00:2","TCP","644","[TCP Retransmission] 49153  >  8080 [ACK] Seq=61641 Ack=1 Win=131072 Len=536 TSval=69384 TSecr=69375"
"11823","69.392998","fe80::200:ff:fe00:51","fe80::200:ff:fe00:2","TCP","644","[TCP Retransmission] 49153  >  8080 [ACK] Seq=62177 Ack=1 Win=131072 Len=536 TSval=69384 TSecr=69375"
"11827","69.400587","fe80::200:ff:fe00:51","fe80::200:ff:fe00:2","TCP","644","[TCP Spurious Retransmission] 49153  >  8080 [ACK] Seq=62713 Ack=1 Win=131072 Len=536 TSval=69384 TSecr=69375"
"11831","69.407756","fe80::200:ff:fe00:51","fe80::200:ff:fe00:2","TCP","644","[TCP Spurious Retransmission] 49153  >  8080 [ACK] Seq=63249 Ack=1 Win=131072 Len=536 TSval=69392 TSecr=69381"
"11833","69.413505","fe80::200:ff:fe00:51","fe80::200:ff:fe00:2","TCP","644","[TCP Retransmission] 49153  >  8080 [ACK] Seq=63785 Ack=1 Win=131072 Len=536 TSval=69393 TSecr=69390"
"11835","69.419574","fe80::200:ff:fe00:51","fe80::200:ff:fe00:2","TCP","644","[TCP Retransmission] 49153  >  8080 [ACK] Seq=64321 Ack=1 Win=131072 Len=536 TSval=69400 TSecr=69399"
"11839","69.426983","fe80::200:ff:fe00:51","fe80::200:ff:fe00:2","TCP","644","[TCP Retransmission] 49153  >  8080 [ACK] Seq=64857 Ack=1 Win=131072 Len=536 TSval=69400 TSecr=69399"
"11841","69.432852","fe80::200:ff:fe00:51","fe80::200:ff:fe00:2","TCP","644","[TCP Retransmission] 49153  >  8080 [ACK] Seq=65393 Ack=1 Win=131072 Len=536 TSval=69400 TSecr=69399"
"11846","69.439365","fe80::200:ff:fe00:51","fe80::200:ff:fe00:2","TCP","644","[TCP Retransmission] 49153  >  8080 [ACK] Seq=65393 Ack=1 Win=131072 Len=536 TSval=69400 TSecr=69399"
"11850","69.446382","fe80::200:ff:fe00:51","fe80::200:ff:fe00:2","TCP","644","[TCP Retransmission] 49153  >  8080 [ACK] Seq=65929 Ack=1 Win=131072 Len=536 TSval=69400 TSecr=69399"
"11856","69.454468","fe80::200:ff:fe00:51","fe80::200:ff:fe00:2","TCP","644","[TCP Spurious Retransmission] 49153  >  8080 [ACK] Seq=66465 Ack=1 Win=131072 Len=536 TSval=69408 TSecr=69407"
"11860","69.461405","fe80::200:ff:fe00:51","fe80::200:ff:fe00:2","TCP","644","[TCP Spurious Retransmission] 49153  >  8080 [ACK] Seq=67001 Ack=1 Win=131072 Len=536 TSval=69427 TSecr=69414"
"11864","69.468322","fe80::200:ff:fe00:51","fe80::200:ff:fe00:2","TCP","644","[TCP Spurious Retransmission] 49153  >  8080 [ACK] Seq=67537 Ack=1 Win=131072 Len=536 TSval=69438 TSecr=69419"
"11868","69.475419","fe80::200:ff:fe00:51","fe80::200:ff:fe00:2","TCP","644","[TCP Spurious Retransmission] 49153  >  8080 [ACK] Seq=68073 Ack=1 Win=131072 Len=536 TSval=69439 TSecr=69426"
"11870","69.481248","fe80::200:ff:fe00:51","fe80::200:ff:fe00:2","TCP","644","[TCP Fast Retransmission] 49153  >  8080 [ACK] Seq=68609 Ack=1 Win=131072 Len=536 TSval=69446 TSecr=69433"
"11874","69.488205","fe80::200:ff:fe00:51","fe80::200:ff:fe00:2","TCP","644","[TCP Retransmission] 49153  >  8080 [ACK] Seq=69145 Ack=1 Win=131072 Len=536 TSval=69454 TSecr=69445"
"11880","69.496471","fe80::200:ff:fe00:51","fe80::200:ff:fe00:2","TCP","644","[TCP Spurious Retransmission] 49153  >  8080 [ACK] Seq=69681 Ack=1 Win=131072 Len=536 TSval=69454 TSecr=69445"
"11882","69.503448","fe80::200:ff:fe00:51","fe80::200:ff:fe00:2","TCP","644","[TCP Spurious Retransmission] 49153  >  8080 [ACK] Seq=70217 Ack=1 Win=131072 Len=536 TSval=69454 TSecr=69445"
"11884","69.509396","fe80::200:ff:fe00:51","fe80::200:ff:fe00:2","TCP","644","[TCP Spurious Retransmission] 49153  >  8080 [ACK] Seq=70753 Ack=1 Win=131072 Len=536 TSval=69454 TSecr=69445"
"11886","69.512909","fe80::200:ff:fe00:51","fe80::200:ff:fe00:2","TCP","644","[TCP Spurious Retransmission] 49153  >  8080 [ACK] Seq=71289 Ack=1 Win=131072 Len=536 TSval=69454 TSecr=69445"
"11892","69.518239","fe80::200:ff:fe00:51","fe80::200:ff:fe00:2","TCP","644","[TCP Spurious Retransmission] 49153  >  8080 [ACK] Seq=71825 Ack=1 Win=131072 Len=536 TSval=69454 TSecr=69445"
"11895","69.523320","fe80::200:ff:fe00:51","fe80::200:ff:fe00:2","TCP","644","[TCP Spurious Retransmission] 49153  >  8080 [ACK] Seq=71825 Ack=1 Win=131072 Len=536 TSval=69454 TSecr=69445"
"11898","69.528361","fe80::200:ff:fe00:51","fe80::200:ff:fe00:2","TCP","644","[TCP Spurious Retransmission] 49153  >  8080 [ACK] Seq=71825 Ack=1 Win=131072 Len=536 TSval=69454 TSecr=69445"
"11902","69.535218","fe80::200:ff:fe00:51","fe80::200:ff:fe00:2","TCP","644","[TCP Spurious Retransmission] 49153  >  8080 [ACK] Seq=72361 Ack=1 Win=131072 Len=536 TSval=69454 TSecr=69445"
"11904","69.542121","fe80::200:ff:fe00:51","fe80::200:ff:fe00:2","TCP","644","[TCP Fast Retransmission] 49153  >  8080 [ACK] Seq=72897 Ack=1 Win=131072 Len=536 TSval=69455 TSecr=69452"
"11908","69.548958","fe80::200:ff:fe00:51","fe80::200:ff:fe00:2","TCP","644","[TCP Retransmission] 49153  >  8080 [ACK] Seq=73433 Ack=1 Win=131072 Len=536 TSval=69462 TSecr=69460"
"11914","69.556944","fe80::200:ff:fe00:51","fe80::200:ff:fe00:2","TCP","644","[TCP Retransmission] 49153  >  8080 [ACK] Seq=73969 Ack=1 Win=131072 Len=536 TSval=69469 TSecr=69467"
"11918","69.563961","fe80::200:ff:fe00:51","fe80::200:ff:fe00:2","TCP","644","[TCP Retransmission] 49153  >  8080 [ACK] Seq=74505 Ack=1 Win=131072 Len=536 TSval=69475 TSecr=69474"
"11920","69.569809","fe80::200:ff:fe00:51","fe80::200:ff:fe00:2","TCP","644","[TCP Retransmission] 49153  >  8080 [ACK] Seq=75041 Ack=1 Win=131072 Len=536 TSval=69488 TSecr=69481"
"11926","69.578095","fe80::200:ff:fe00:51","fe80::200:ff:fe00:2","TCP","644","[TCP Retransmission] 49153  >  8080 [ACK] Seq=75577 Ack=1 Win=131072 Len=536 TSval=69496 TSecr=69487"
"11930","69.585372","fe80::200:ff:fe00:51","fe80::200:ff:fe00:2","TCP","644","[TCP Retransmission] 49153  >  8080 [ACK] Seq=76113 Ack=1 Win=131072 Len=536 TSval=69496 TSecr=69487"
"11934","69.592449","fe80::200:ff:fe00:51","fe80::200:ff:fe00:2","TCP","644","[TCP Retransmission] 49153  >  8080 [ACK] Seq=76649 Ack=1 Win=131072 Len=536 TSval=69496 TSecr=69487"
